ID_CI,ID_DELITO,DTO,DTO_PRIN,MODA_DTO,FORMA_ACC,FHA_DE_HCHOS,HRA_DE_HCHOS,EMTO_COM_DTO,GRDO_CONS,CLASF_DE_DTO,NOM_ENT_HCHOS,ID_ENT_HCHOS,NOM_MUN_HCHOS,ID_MUN_HCHOS,NOM_LOC_HCHOS,ID_LOC_HCHOS,NOM_COL_HCHOS,ID_COL_HCHOS,CP,COORD_X,COORD_Y,DOM_HCHOS
4DC4CCE7-5F0B-4E36-B2F4-6E81C8ADC38B,006DE32A-89B1-4BDC-9128-624C7220AB1C,"Abuso sexual",1,Doloso,2,2024-11-22,11:19:00,8,1,3.1,Chiapas,7,"Tuxtla Gutiérrez",101,"La Pimienta",71010337,"La Pimienta",209,0,-93.119430541992,16.753555722429,"Copoya, LA PIMIENTA, TUXTLA GUTIERREZ, CHIAPAS, 00000"
0F0FEEFC-F974-4290-AA37-FA15C404F194,012B7DD2-A37C-4BFA-A99C-4F975C411E68,Violación,1,Doloso,1,2025-05-19,19:55:00,3,2,3.8.1,Chiapas,7,"Tuxtla Gutiérrez",101,"Tuxtla Gutiérrez",71010001,"Albania Baja",28,29010,-93.110418319702,16.776839036236,"Avenida 20 de Noviembre, ALBANIA BAJA, TUXTLA GUTIERREZ, CHIAPAS, 29010"
F5FDE5FB-5FAF-4EEE-B840-5CBE586CC395,0260689F-3491-47AC-A77A-04F257740908,Homicidio,1,Culposo,1,2025-05-28,13:01:00,8,1,1.1.2,Chiapas,7,"Tuxtla Chico",102,"Tuxtla Chico",71020001,"Medio Monte 2a Sección",13,30870,-92.17610836029,14.931113850208,"Primera Sección de Izapa, MEDIO MONTE 2A SECCION, TUXTLA CHICO, CHIAPAS, 30870"
B62B1DB7-F4F6-4836-95EC-2AC2AF8DA16A,027838C7-1CFE-4678-A2DA-40CC38229176,"Contra la salud (Narcomenudeo)",1,Doloso,2,2025-05-02,23:41:00,8,1,7.1.2,Chiapas,7,"Frontera Comalapa",34,"Frontera Comalapa",70340001,"Centro Frontera comalapa",27,30140,-92.143020629883,15.659037096478,"El Triunfo, CENTRO FRONTERA COMALAPA, FRONTERA COMALAPA, CHIAPAS, 30140"
4A9A0F93-1726-4142-A641-57F1FC33F3E7,02EBC70A-AB8A-4E92-9DE0-EED804506A37,"Desobediencia y resistencia de particulares",1,Doloso,2,2025-05-18,18:07:00,6,1,7.11.1,Chiapas,7,"Tuxtla Gutiérrez",101,"Tuxtla Gutiérrez",71010001,"Residencial  Granja",351,29030,-93.137387663277,16.755684309087,"Calichal, RESIDENCIAL  GRANJA, TUXTLA GUTIERREZ, CHIAPAS, 29030"
508EC999-166D-4742-8BD1-3D2A00278379,03651E42-6920-47A9-81DC-F8F60519A74B,Lesiones,0,Doloso,1,2025-05-18,18:37:00,1,1,1.2.1,Chiapas,7,"Tuxtla Gutiérrez",101,"Tuxtla Gutiérrez",71010001,"Nueva Jerusalen",461,29020,-93.207192420959,16.786032411916,"Tuxtla Gutiérrez, NUEVA JERUSALEN, TUXTLA GUTIERREZ, CHIAPAS, 29020"
ED858BD3-BCCB-4460-A97F-BF5549F1A818,03A21C64-FACC-434E-8498-59AB9DEBA036,"Violencia familiar",1,Doloso,1,2025-05-19,20:36:00,8,1,5.1,Chiapas,7,"Tuxtla Gutiérrez",101,"Tuxtla Gutiérrez",71010001,"San Francisco",374,29066,-93.114658918264,16.739665753385,"Calle 4 Oriente Sur SAN FRANCISCO TUXTLA GUTIERREZ CHIAPAS 29066"
71F4184E-6477-435E-9CD0-49EAAD8472AC,03CB054C-0737-49EC-8559-BF856538F4F9,Homicidio,1,Culposo,1,2025-05-25,18:45:00,4,1,1.1.2,Chiapas,7,Acapetahua,3,Acapetahua,70030001,"Otra colonia",-10,30580,-92.747039185015,15.253873114957,"OTRA COLONIA, ACAPETAHUA, CHIAPAS, 30580"
648659E8-90EB-48C8-BA04-FBDF8055D6F4,03F5F59E-B269-4A26-8241-46A84AAA0658,"Ataques a las vías de comunicación",1,Culposo,1,2025-05-31,20:25:00,8,1,7.10,Chiapas,7,Tenejapa,93,Tenejapa,70930001,"Otra colonia",-10,29480,-92.506272601811,16.818913205631,"OTRA COLONIA, TENEJAPA, CHIAPAS, 29480"
8C90B13F-B36B-4E4C-AEDE-D23664E979A0,0477973E-6C10-4B09-8673-619643AAC862,"Violencia familiar",1,Doloso,1,2025-03-15,10:40:00,8,1,5.1,Chiapas,7,Palenque,65,Palenque,70650001,"Los Robles",50,29960,-91.988697052002,17.498990767307,"Palenque, LOS ROBLES, PALENQUE, CHIAPAS, 29960"
6A521BB1-DBC1-48FF-853F-A5F051890136,049FE3C4-3597-478B-A08D-56ED3DE57B03,Pederastia,1,Doloso,2,2025-05-14,12:28:00,6,1,3.7,Chiapas,7,Palenque,65,Palenque,70650001,"Otra colonia",-10,29960,-91.988697052002,17.497844742775,"Palenque, OTRA COLONIA, PALENQUE, CHIAPAS, 29960"
E7588F26-57B0-41A3-9B4A-CABDDD5C897F,04C7AF12-6E50-49A7-8E84-25903C111B00,"Contra la salud (Narcomenudeo)",1,Doloso,2,2025-05-16,11:54:00,8,1,7.1.2,Chiapas,7,Palenque,65,Palenque,70650001,"Palenque Centro",67,29960,-91.976852416992,17.504297431777,"Palenque, PALENQUE CENTRO, PALENQUE, CHIAPAS, 29960"
242B47A9-54CF-472D-B483-6AD0F202A050,0599810F-F124-4FB8-B200-8F9E93BC965C,Ecocidio,1,Doloso,2,2025-05-21,04:35:00,6,1,7.7,Chiapas,7,Ocosingo,59,Ocosingo,70590001,"Ocosingo Centro",76,29950,-92.103452682495,16.919437649707,"OCOSINGO CENTRO, OCOSINGO, CHIAPAS, 29950"
1398F171-9335-4242-A0B5-9E34BE1A5BA5,05B24AD0-C355-47C4-8408-E5E527075EA7,"Violencia familiar",1,Doloso,1,2025-05-28,12:00:00,6,1,5.1,Chiapas,7,"Tuxtla Gutiérrez",101,"Tuxtla Gutiérrez",71010001,"La Misión",207,29096,-93.073253631592,16.741597069391,"Boulevard La Mision, LA MISION, TUXTLA GUTIERREZ, CHIAPAS, 29096"
0D56E38D-E60C-45E6-B03F-E74EFD705394,06180AD1-245E-470C-A5AE-5EDCA9C4EBAF,"Armas prohibidas",1,Doloso,2,2025-05-04,12:15:00,8,1,7.10,Chiapas,7,Tapachula,89,"Tapachula de Córdova y Ordóñez",70890001,"Brisas del Cahuacan",44,30789,-92.279701242616,14.886899486764,"Framboyanes, BRISAS DEL CAHUACAN, TAPACHULA, CHIAPAS, 30789"
FD0F92F0-BA49-4BC8-8CF2-93D6494DF81C,062899EC-AD04-4D30-9331-E4FCC214A56A,"Robo a Transeúnte",1,Doloso,1,2025-05-18,18:36:00,1,1,4.1.6,Chiapas,7,Berriozábal,12,Berriozábal,70120001,Berriozabal,3,29130,-93.271264477431,16.7964440653,"San Miguel, BERRIOZABAL, BERRIOZABAL, CHIAPAS, 29130"
A6DA02CA-6CE0-45EE-ACDA-3E46E23EA0EB,06F0FA56-2934-495E-90CE-35AFF188B67B,"Robo a Casa Habitación",1,Doloso,1,2023-09-17,07:00:00,6,1,4.1.1,Chiapas,7,"Tuxtla Gutiérrez",101,"Tuxtla Gutiérrez",71010001,"Real del Bosque",349,0,-93.106048921317,16.742323676358,"AVENIDA DE LOS CIRUELOS NUMERO 350, VIVIENDA “A”, MANZANA 47 LOTE 49 DEL CONDOMINIO DENOMINADO “PALMA REAL 08” DEL FRACCIONAMIENTO REAL DEL BOSQUE, TUXTLA GUTIERREZ, CHIAPAS,México"
CBB04B4D-E22E-4E57-8ED5-71D8CC7B6517,070BDFA0-FEE5-46FE-AC80-E94C733C687F,"Robo de Vehículo",1,Doloso,2,2025-04-26,17:30:00,6,1,4.1.2.2,Chiapas,7,Escuintla,32,Escuintla,70320001,Escuintla,31,30600,-92.655000686645,15.324307678379,"Boulevard Benito Juarez ESCUINTLA ESCUINTLA CHIAPAS 30600"
4B2BAED6-3E9D-4FF2-BA57-635BC0C7E321,071988A4-A0D1-4F2B-9A8C-19F4915F076F,"Contra la salud (Narcomenudeo)",1,Doloso,2,2025-05-15,10:10:00,8,1,7.1.1,Chiapas,7,Huixtla,40,Huixtla,70400001,"Huixtla Centro",32,30640,-92.480163574219,15.141493576542,"San Francisco, HUIXTLA CENTRO, HUIXTLA, CHIAPAS, 30640"
45AB6FAE-5A8A-4611-B7DC-59233178FB1A,07CC5462-A253-4EF7-ABBF-9FC6C61E657B,Despojo,1,Doloso,2,2023-08-04,10:08:00,6,1,4.6,Chiapas,7,Cintalapa,17,"Cintalapa de Figueroa",70170001,"Cintalapa de Figueroa Centro",9,30400,-93.824820449913,16.730355866375,"Emiliano Zapata, Cintalapa, Chiapas, México"
5B327D11-E675-4385-BC81-910159DDF5E9,087D37CC-A0A0-4CAB-A4DD-E18C04875A4C,"Contra la salud (Narcomenudeo)",1,Doloso,2,2025-05-09,11:10:00,8,1,7.1.1,Chiapas,7,Tapachula,89,"Tapachula de Córdova y Ordóñez",70890001,"Fracc. Terranova",430,30700,-92.257927084214,14.869221246965,"Tapachula, FRACC TERRANOVA, TAPACHULA, CHIAPAS, 30700"
154AD922-DBF2-4D08-BFD6-6668545F9BB9,08C3E08D-488B-4F9F-9B98-FB64F64D4E10,"Robo de Vehículo",1,Doloso,2,2025-05-22,13:53:00,6,1,4.1.14,Chiapas,7,Pantelhó,66,Pantelhó,70660001,"Otra colonia",-10,29880,-92.472728741368,17.005526623433,"Guadalupe de la Peña, OTRA COLONIA, PANTELHO, CHIAPAS, 29880"
5725B99C-9196-4915-A58D-B2ACBEBBABB6,093D1C97-F66C-434F-9BAE-1E27C838EA33,Feminicidio,1,Doloso,1,2025-05-20,23:59:00,2,1,1.3,Chiapas,7,"Salto de Agua",77,"Salto de Agua",70770001,"Rubí Tulija",19,29906,-92.032790498097,17.279711072036,"Generación 95, RUBI TULIJA, SALTO DE AGUA, CHIAPAS, 29906"
8CA3F93C-D58D-4901-999B-58CFAD8E8CCB,09862ABC-B91C-4530-B3B7-F34C42C833CB,"Encubrimiento por receptación",1,Culposo,2,2025-05-03,17:40:00,8,1,4.7,Chiapas,7,Tapachula,89,"Tapachula de Córdova y Ordóñez",70890001,"Ciudad de Tapachula",61,30709,-92.262535106365,14.903341345063,"Framboyanes, CIUDAD DE TAPACHULA, TAPACHULA, CHIAPAS, 30709"
C585B410-94EA-4388-A9CF-55A8F89A54CE,0A2F83AB-A760-48A8-A24F-AEA944494E93,"Usurpación de profesión",0,Doloso,2,2024-09-18,14:48:00,8,1,7.8,Chiapas,7,Tapachula,89,"Tapachula de Córdova y Ordóñez",70890001,"Tapachula Centro",325,30700,-92.252538436081,14.893482596088,"Framboyanes, TAPACHULA CENTRO, TAPACHULA, CHIAPAS, 30700"
F4F5D2F8-4138-4D58-9366-0F2BF65D8950,0A438BC9-CD11-42A4-8F99-C20EDC857B9B,Homicidio,1,Culposo,1,2025-05-31,21:36:00,4,1,1.1.2,Chiapas,7,Tuzantán,103,"La Cruz de Oro",71030119,"La Cruz de Oro",72,30680,-92.435784700037,15.126503580137,"LA CRUZ DE ORO, TUZANTAN, CHIAPAS, 30680"
DA75D31B-E452-4870-A7D5-881E30B21BE0,0A739256-F1A5-4745-946F-A406DA1BCD0F,"Contra la salud (Narcomenudeo)",1,Doloso,2,2025-05-04,16:08:00,8,1,7.1.2,Chiapas,7,"Benemérito de las Américas",114,"Benemérito de las Américas",71140001,"Benemérito de las Américas",1,29955,-90.653172011234,16.515306312085,"0, BENEMERITO DE LAS AMERICAS, BENEMERITO DE LAS AMERICAS, CHIAPAS, 29955"
4B61BD0E-EF66-426E-A9E5-E2BC7D566101,0AC3F683-8E03-4F3E-A298-35B0DF36E065,Homicidio,1,Doloso,1,2025-05-23,23:41:00,1,1,1.1.1,Chiapas,7,Tapachula,89,"Tapachula de Córdova y Ordóñez",70890001,"Otra colonia",-10,30700,-92.27108001709,14.899963098062,"Framboyanes, OTRA COLONIA, TAPACHULA, CHIAPAS, 30700"
22A65F62-2357-4D4B-A922-22B05F04117D,0B7164DA-BA3D-43A8-9B0C-7A8EA7BF3BB8,"Encubrimiento por receptación",1,Culposo,2,2025-05-11,13:55:00,8,1,4.7,Chiapas,7,Huixtla,40,Huixtla,70400001,"2 de Octubre",2,30640,-92.456431388855,15.146103146904,"Huixtla, 2 DE OCTUBRE, HUIXTLA, CHIAPAS, 30640"
C832E7DB-8466-41B5-8680-0209240F60B8,0B905895-EBD5-4BB3-A790-D1D3A635089A,"Armas prohibidas",0,Doloso,2,2025-05-13,20:37:00,8,1,7.10,Chiapas,7,Teopisca,94,Teopisca,70940001,Teopisca,10,29410,-92.473297119141,16.542381703219,"Teopisca, TEOPISCA, TEOPISCA, CHIAPAS, 29410"
E6154634-05C2-41F5-8449-B80A4A3EED1A,0BA491AC-5D18-424D-8DA7-42E082CE5E2B,Lesiones,1,Culposo,1,2025-05-12,10:55:00,4,1,1.2.2,Chiapas,7,"Chiapa de Corzo",27,"Chiapa de Corzo",70270001,"Benito Juárez",6,29160,-93.006997704506,16.705864485238,"Avenida Miguel Hidalgo, BENITO JUAREZ, CHIAPA DE CORZO, CHIAPAS, 29160"
CAB8057D-AE34-401F-88C0-808E4A5C8ABC,0BE5143B-BCA0-4F52-B169-AD45746C3A1E,"Violencia familiar",1,Doloso,1,2025-04-12,16:00:00,6,1,5.1,Chiapas,7,"Tuxtla Gutiérrez",101,"Tuxtla Gutiérrez",71010001,"San Roque",395,29080,-93.113014698028,16.74888189456,"Avenida 5a Sur Oriente, SAN ROQUE, TUXTLA GUTIERREZ, CHIAPAS, 29080"
4E7E6481-3AE5-4CF1-9D60-5D8A81F47561,0C8FAC7B-4375-4176-91C5-D930FFB62861,"Robo en Transporte",1,Doloso,1,2025-05-08,00:06:00,2,1,4.1.9,Chiapas,7,Catazajá,16,Catazajá,70160001,Catazaja,3,29980,-92.01358795166,17.723962074686,"Catazajá, CATAZAJA, CATAZAJA, CHIAPAS, 29980"
471CD9B1-49B5-4F37-8082-ADF07C9BD87E,0CD53427-40DD-4691-B9C0-5EE67694BC99,"Encubrimiento por receptación",1,Culposo,2,2025-05-26,19:19:00,8,1,4.7,Chiapas,7,Arriaga,9,"Agua Zarca",70090197,Azteca,4,30461,-93.944300279445,16.221799268261,"AZTECA, ARRIAGA, CHIAPAS, 30461"
92C4EAAA-2435-47ED-8F0A-EA4EBC53B077,0CEA88BF-A1AC-4CAD-89BE-95A118D41C67,Homicidio,0,Doloso,1,2025-05-01,16:26:00,2,2,1.1.1,Chiapas,7,Palenque,65,Palenque,70650001,"Palenque Centro",67,29960,-91.989555358887,17.507994994277,"Pakal-Ná, PALENQUE CENTRO, PALENQUE, CHIAPAS, 29960"
DE9566B7-01D5-4FAA-AFFF-0B96B6879BA8,0D0034E6-AB8A-4E83-80DE-9170D2D74136,"Ataques a las vías de comunicación",1,Culposo,1,2025-05-05,20:48:00,8,1,7.10,Chiapas,7,Mazatán,54,Mazatán,70540001,Mazatán,12,30650,-92.448907792568,14.864301119196,"Calle Doctor Belisario Domínguez Oriente, MAZATAN, MAZATAN, CHIAPAS, 30650"
0121BA0F-45C1-45D3-892C-534D10725D8A,0D04E227-5B8A-4019-B884-0C2B96E4D4B1,Pederastia,1,Doloso,2,2025-03-27,14:00:00,6,1,3.7,Chiapas,7,"Comitán de Domínguez",19,"Comitán de Domínguez",70190001,Nicalocok,105,30068,-92.140522885909,16.241535425868,"Calle 8a Sur Poniente, NICALOCOK, COMITAN DE DOMINGUEZ, CHIAPAS, 30068"
73CDF162-74BA-40EC-9EEF-22FC808A8ECF,0D9A4731-EFED-43A1-8AD4-8B4BC42DA22F,"Contra la salud (Narcomenudeo)",1,Doloso,2,2025-05-03,01:12:00,8,1,7.1.2,Chiapas,7,"San Cristóbal de las Casas",78,"San Cristóbal de las Casas",70780001,"San Cristóbal de las Casas Centro",145,29200,-92.641407251358,16.736962279423,"Estacionamento Hotel Mansion del Valle, SAN CRISTOBAL DE LAS CASAS CENTRO, SAN CRISTOBAL DE LAS CASAS, CHIAPAS, 29200"
D0C1718F-EEFB-4B95-9ED1-B3CA374961AA,0E405919-8DF5-4069-BAB6-D1F399DF7810,"Robo de Vehículo",1,Doloso,2,2025-05-23,18:15:00,6,1,4.1.2.2,Chiapas,7,"Tuxtla Gutiérrez",101,"Tuxtla Gutiérrez",71010001,"Villa San Marcos",427,29010,-93.101473152637,16.767690881059,"Avenida El Progreso, VILLA SAN MARCOS, TUXTLA GUTIERREZ, CHIAPAS, 29010"
6958977D-FF50-4651-8E8E-33A37D6CA778,0E44F05D-7B81-48E6-A109-AD36CF5D37BE,"Contra la salud (Narcomenudeo)",1,Doloso,2,2025-05-25,22:38:00,8,1,7.1.2,Chiapas,7,Tapachula,89,"Tapachula de Córdova y Ordóñez",70890001,"Ciudad de Tapachula",61,30709,-92.268676757812,14.898858893401,"Tapachula, CIUDAD DE TAPACHULA, TAPACHULA, CHIAPAS, 30709"
0288B900-F95F-43FF-987B-A457B74AF908,0E614552-B91E-4199-92E9-8C092109DBA1,"Robo a Negocio",1,Doloso,1,2025-05-28,13:19:00,1,1,4.1.11,Chiapas,7,"Tuxtla Gutiérrez",101,"Tuxtla Gutiérrez",71010001,"Tuxtla Gutiérrez Centro",418,29000,-93.118188679218,16.75402453318,"Avenida Central Poniente, TUXTLA GUTIERREZ CENTRO, TUXTLA GUTIERREZ, CHIAPAS, 29000"
D8932ADC-B8AF-44C2-84F2-2C898A000795,0EC70ED2-9FB3-484A-A45A-524317340F76,Violación,1,Doloso,1,2025-03-25,23:21:00,3,1,3.8.1,Chiapas,7,"Comitán de Domínguez",19,"Comitán de Domínguez",70190001,"La Cueva",72,30067,-92.15944647789,16.245081687088,"Calle 5a Norte Poniente, LA CUEVA, COMITAN DE DOMINGUEZ, CHIAPAS, 30067"
BDFD4166-E79D-4B2A-825E-9856E3184D01,0EE624C7-2650-4BAE-AB7A-9A33145FB15F,Lesiones,1,Culposo,1,2025-05-26,09:55:00,4,1,1.2.2,Chiapas,7,Huehuetán,37,Huehuetán,70370001,Huehuetan,28,30670,-92.40686416626,15.008376258444,"Avenida Emiliano Zapata, HUEHUETAN, HUEHUETAN, CHIAPAS, 30670"
40FC20F6-2979-48C4-B458-F19E4759FD2F,0F02D526-563F-40D3-A6DC-C575D0820736,Pederastia,1,Doloso,1,2025-05-28,14:19:00,3,1,3.7,Chiapas,7,Sabanilla,76,Sabanilla,70760001,Sabanilla,11,29800,-92.55312955662,17.284709767376,"Sabanilla, SABANILLA, SABANILLA, CHIAPAS, 29800"
672E7122-C51F-4345-AFAB-CF145D6DFBFB,0F437B1D-A1CB-483C-871C-8829917FD28E,"Abuso sexual",1,Doloso,2,2025-02-11,01:00:00,8,1,3.1,Chiapas,7,"Las Margaritas",52,"Las Margaritas",70520001,"Barrio San Sebastian",76,30187,-91.99473051436,16.314231455715,"Las Margaritas, BARRIO SAN SEBASTIAN, LAS MARGARITAS, CHIAPAS, 30187"
9DEE7056-C619-4DEC-AFB1-FF3F5528D8DC,0F69B364-0639-4808-B2ED-F886397235FD,Homicidio,1,Doloso,1,2025-05-09,00:25:00,1,1,1.1.1,Chiapas,7,Huixtla,40,Huixtla,70400001,"Playa Grande",48,30649,-92.518672943552,15.114406139675,"Cantón Playa Grande, PLAYA GRANDE, HUIXTLA, CHIAPAS, 30649"
68A82F98-529C-4D97-9C5B-B9D92E322711,0F69F225-74AF-4443-AAFF-461296F8F27F,"Contra la salud (Narcomenudeo)",1,Doloso,2,2025-05-05,16:17:00,8,1,7.1.2,Chiapas,7,"Benemérito de las Américas",114,"Benemérito de las Américas",71140001,"Benemérito de las Américas",1,29955,-90.658840328109,16.515763476228,"0, BENEMERITO DE LAS AMERICAS, BENEMERITO DE LAS AMERICAS, CHIAPAS, 29955"
667F65DA-F847-4FC0-BFF1-4FAE5ABB560D,0F78E544-1E3E-4972-B168-B320449D0E2F,Homicidio,0,Doloso,1,2025-05-12,22:10:00,1,2,1.1.1,Chiapas,7,Suchiate,87,"Ciudad Hidalgo",70870001,"Ciudad Hidalgo",16,30840,-92.18713760376,14.620092834475,"Ignacio López Rayón, CIUDAD HIDALGO, SUCHIATE, CHIAPAS, 30840"
7670D7AC-6E88-44D4-91FE-472E547E3642,0FB08E38-CC75-4D6E-BD8F-55963EC13C9B,Homicidio,1,Culposo,1,2025-05-25,17:00:00,6,1,1.1.2,Chiapas,7,Simojovel,81,"Benito Juárez",70810268,"Benito Juárez",7,29823,-92.709159851074,17.139114135024,"Simojovel de Allende, BENITO JUAREZ, SIMOJOVEL, CHIAPAS, 29823"
62DD32D8-AAA4-4C4F-8BF4-5EF8E3B43D0F,0FEBA983-48D6-4391-B658-8FA030E1B9F0,"Ataques a las vías de comunicación",1,Culposo,1,2025-05-02,01:11:00,8,1,7.10,Chiapas,7,"Tuxtla Gutiérrez",101,"Tuxtla Gutiérrez",71010001,"Villa San Marcos",427,29010,-93.104372620583,16.767058548957,"Calzada al Sumidero, VILLA SAN MARCOS, TUXTLA GUTIERREZ, CHIAPAS, 29010"
96EF2EED-50F3-4F2C-AF28-82BA9EE0FCE7,101E305C-E58E-4DE9-85FF-D7D1156D060F,"Contra la salud (Narcomenudeo)",1,Doloso,2,2025-05-31,18:50:00,8,1,7.1.2,Chiapas,7,"Tuxtla Gutiérrez",101,"Tuxtla Gutiérrez",71010001,"Francisco I Madero",162,29090,-93.106969852734,16.740487609523,"Calle 13 Oriente Sur, FRANCISCO I MADERO, TUXTLA GUTIERREZ, CHIAPAS, 29090"
65645AAB-1D6E-4519-BE2C-A2C2C28E8F23,1028C7F7-A907-41B8-B33E-88579A604B55,Homicidio,1,Doloso,1,2025-05-11,10:03:00,2,1,1.1.1,Chiapas,7,Suchiate,87,Suchiate,70870184,Suchiate,107,30843,-92.210324366977,14.668461283701,"Nuevo Dorado, SUCHIATE, SUCHIATE, CHIAPAS, 30843"
06C1EBBF-C516-44FA-8BE0-9960EF8511F8,1068F73A-E82C-4ACE-A29D-3E7DA0D76C67,"Robo de Vehículo",1,Doloso,2,2025-05-10,01:00:00,6,1,4.1.2.2,Chiapas,7,"San Cristóbal de las Casas",78,"San Cristóbal de las Casas",70780001,"La Independencia",81,29247,-92.643756866455,16.736788739498,"Vistahermosa Huitepec, LA INDEPENDENCIA, SAN CRISTOBAL DE LAS CASAS, CHIAPAS, 29247"
64518113-1DB7-489E-8442-E5B909684454,10A0EE2C-8D74-492E-8D96-2671412A60B0,Homicidio,1,Culposo,1,2025-05-10,10:52:00,6,1,1.1.2,Chiapas,7,Ocosingo,59,Ocosingo,70590001,Ocosingo,75,29950,-92.097187042236,16.906527111219,"Los Pinos, OCOSINGO, OCOSINGO, CHIAPAS, 29950"
7A0786A4-7698-4C08-84A3-F73019880376,112F6189-7C5A-411D-A384-211066D2BFB9,"Contra la salud (Narcomenudeo)",1,Doloso,2,2025-04-23,17:55:00,8,1,7.1.1,Chiapas,7,"Benemérito de las Américas",114,"Benemérito de las Américas",71140001,"El Azufre",13,29955,-90.649550557136,16.51818415667,"Avenida 21 de Marzo, EL AZUFRE, BENEMERITO DE LAS AMERICAS, CHIAPAS, 29955"
FBEF0B81-C4FB-40CE-9880-14C6866EACFD,11360328-6B44-4BBE-9B05-DB7DD5F9DFD1,Lesiones,0,Culposo,1,2025-05-05,21:45:00,4,1,1.2.2,Chiapas,7,"Chiapa de Corzo",27,"Chiapa de Corzo",70270001,"Benito Juárez",6,29160,-92.993001937866,16.71279729083,"BENITO JUAREZ CHIAPA DE CORZO CHIAPAS 29160"
00046D58-5A1E-4595-BC75-3BB5FEAAD723,114B0C39-4B6D-43C0-8D55-41268FF2D3BE,"Contra la salud (Narcomenudeo)",1,Doloso,2,2025-05-27,21:23:00,8,1,7.1.2,Chiapas,7,Villaflores,108,Villaflores,71080001,"Villaflores Centro",78,30475,-93.272895812988,16.234252692564,"Villaflores, VILLAFLORES CENTRO, VILLAFLORES, CHIAPAS, 30475"
1A3D312D-AA2A-43D2-8A30-F488C870222D,11C8B942-AE44-4276-ACB6-55DDDBE3A55D,"Contra la salud (Narcomenudeo)",1,Doloso,2,2025-05-28,22:40:00,8,1,7.1.2,Chiapas,7,Jiquipilas,46,Jiquipilas,70460001,"Jiquipilas Centro",13,30430,-93.653726577759,16.669006038493,"Avenida Tercera Sur, JIQUIPILAS CENTRO, JIQUIPILAS, CHIAPAS, 30430"
F2BB023A-1970-4E0A-8756-CBFC734A2248,11EC1683-E53D-44C7-8DB1-27467A1BC37E,Lesiones,1,Culposo,1,2023-03-10,09:43:00,6,1,1.2.2,Chiapas,7,"Tuxtla Gutiérrez",101,"Tuxtla Gutiérrez",71010001,"El Retiro",138,29000,-93.084406256676,16.748700339171,"Calle Guatemala, Tuxtla Gutiérrez, Chiapas, 29077, México"
780330CC-24D9-4C2A-B186-370B060ADF89,11F01C62-66C4-4D52-8659-014E03F7318F,"Hostigamiento Sexual",1,Doloso,2,2025-04-05,15:17:00,6,1,3.3,Chiapas,7,Pijijiapan,69,Pijijiapan,70690001,"Otra colonia",-10,30540,-93.209604055964,15.688278164984,"Pijijiapan, OTRA COLONIA, PIJIJIAPAN, CHIAPAS, 30540"
C4649731-CAA0-4B84-AA68-786F86FBD9F1,12137701-BFB8-4704-B35E-0499BDBE6764,Homicidio,1,Doloso,1,2025-05-10,14:32:00,1,1,1.1.1,Chiapas,7,Motozintla,57,"Tuixcum Chico",70570126,"Tuixcum Chico",61,30709,-92.218558235681,15.341818668751,"DOMICILIO CONOCIDO"
47372EFA-899B-496B-B2F8-6CDE7B1A4019,1214479F-AB51-41B8-B08F-6DDB8B096998,Homicidio,1,Culposo,1,2025-05-17,01:07:00,4,1,1.1.2,Chiapas,7,Tonalá,97,Altamira,70970452,Altamira,4,30506,-93.121318817139,16.754955986866,"Boulevard Los Laguitos ALTAMIRA TONALA CHIAPAS 30506"
E4E0CE1E-AE63-4135-A018-F432C86058BE,12C12F01-687A-4A14-A6BF-6EA142D70F39,"Contra la salud (Narcomenudeo)",1,Doloso,2,2025-05-12,00:27:00,8,1,7.1.2,Chiapas,7,"San Cristóbal de las Casas",78,"San Cristóbal de las Casas",70780001,"El Progreso",47,29243,-92.644271850586,16.737281907124,"Vistahermosa Huitepec, EL PROGRESO, SAN CRISTOBAL DE LAS CASAS, CHIAPAS, 29243"
1480A312-CFAA-43B3-AE3B-5BADD5547049,13104AA4-1F55-49D1-8A50-4886C122ED71,"Ataques a las vías de comunicación",1,Culposo,1,2025-05-13,02:13:00,8,1,7.10,Chiapas,7,"Comitán de Domínguez",19,"El Mirador",70190644,"El Mirador",50,30069,-92.149637639522,16.25824179353,"Al Cerro Nehuestic, EL MIRADOR, COMITAN DE DOMINGUEZ, CHIAPAS, 30069"
5FA9755C-EDB2-495F-9E64-77C857977BA7,13329027-8A91-4A6B-8657-4E5DF662982F,"Abigeato   ",1,Doloso,1,2025-03-24,13:28:00,8,1,4.1.12,Chiapas,7,Tonalá,97,Tonalá,70970001,"Otra colonia",-10,30500,-93.751783,16.091356,"OTRA COLONIA, TONALA, CHIAPAS, 30500"
5229EDCE-32A0-4244-812B-9E533B0051B4,13B90B1D-BDB9-4FAD-A500-CF2FF1722F28,Daños,0,Culposo,1,2025-05-16,21:25:00,8,1,4.5,Chiapas,7,"Las Margaritas",52,"Las Margaritas",70520001,Sacsalum,47,30187,-91.989748477936,16.311034852449,"10a. Avenida Poniente Norte, SACSALUM, LAS MARGARITAS, CHIAPAS, 30187"
203B7D2F-C00A-499E-A873-3771FFD049CE,14373F73-3DB6-4DD0-9CC0-ED5D3B86BD27,"Robo Otros",1,Doloso,1,2025-05-06,19:15:00,1,1,4.1.14,Chiapas,7,Amatán,5,Amatán,70050001,"Otra colonia",-10,29700,-92.819709777832,17.370227689557,"Amatan OTRA COLONIA AMATAN CHIAPAS 29700"
DF6FC54C-B266-4373-90E5-812F7A78BF3B,1491319D-D687-4104-9865-4E9BC78848F8,"Robo Otros",0,Doloso,2,2025-05-06,14:37:00,8,1,4.1.14,Chiapas,7,Tapachula,89,"Tapachula de Córdova y Ordóñez",70890001,"Tapachula Centro",325,30700,-92.261199974115,14.899163037438,"Tapachula, TAPACHULA CENTRO, TAPACHULA, CHIAPAS, 30700"
E39C2500-CE23-4F0A-A0BE-C50878E64B98,150E4FD4-732E-416C-B904-4930077C921F,"Abuso de confianza",0,Doloso,2,2024-09-20,13:14:00,8,1,4.3,Chiapas,7,"Tuxtla Gutiérrez",101,"Tuxtla Gutiérrez",71010001,"Tuxtla Gutiérrez Centro",418,29000,-93.117027282715,16.752240718304,"Copoya, Tuxtla Gutiérrez, Chiapas, 29066, México S/N, S/N"
18B38969-B4EC-4751-BD29-1C965ACE3AE4,1523989E-A854-4D46-BF3E-23F5ACCBB628,"Abuso de confianza",1,Doloso,2,2023-10-02,11:06:00,8,1,4.3,Chiapas,7,"Tuxtla Gutiérrez",101,"Tuxtla Gutiérrez",71010001,"Tuxtla Gutiérrez Centro",418,29000,-93.066419363022,16.739904728339,"Cuarta Poniente, Tuxtla Gutiérrez, Chiapas, 29077, México"
D70DAF65-10D4-4EDA-89E0-A228009FE779,1544B0A3-A859-487F-AC01-0063AC1320E3,Lesiones,1,Doloso,1,2025-05-16,11:12:00,2,1,1.2.1,Chiapas,7,"San Cristóbal de las Casas",78,"San Cristóbal de las Casas",70780001,"Anexo Morelos",232,29300,-92.640695817064,16.733999240033,"NO REFIERE 06, 00"
04A9A12F-0CFD-4CB3-9A4F-5C7A53AA669A,154C6166-8D59-4BC9-A9A0-B73DA47C4613,"Fraude   ",1,Doloso,2,2024-07-03,15:04:00,6,1,4.2,Chiapas,7,Palenque,65,Palenque,70650001,"Otra colonia",-10,29960,-91.985263824463,17.511269147974,"calle bonampak s/n, fraccionamientos pomoca , Palenque, Chiapas, 29960, México"
E6F7F630-117A-45BD-A589-025B7A3397CC,15887C38-3435-49B6-80B2-DF2321DDAB33,Lesiones,1,Culposo,1,2025-05-18,22:57:00,4,1,1.2.2,Chiapas,7,"San Cristóbal de las Casas",78,"San Cristóbal de las Casas",70780001,"Anexo Morelos",232,29300,-92.636747306813,16.736008462629,"NO REFIERE 06, 00"
B2605189-07C1-4664-8E54-AD7F924839D7,1631A685-A28C-4C5F-916A-7111ACD46537,Violación,1,Doloso,1,2025-05-30,12:25:00,3,1,3.8.1,Chiapas,7,Ocosingo,59,Ocosingo,70590001,Ocosingo,75,29950,-92.096672058105,16.907841044651,"Los Pinos, OCOSINGO, OCOSINGO, CHIAPAS, 29950"
8E7D5EC8-1E48-4C64-ABEF-2046F60EDBE5,16B0DAE5-7DA8-498D-A66D-4CFE167878A4,Lesiones,1,Culposo,1,2025-03-27,18:52:00,6,1,1.2.2,Chiapas,7,"Tuxtla Gutiérrez",101,"Tuxtla Gutiérrez",71010001,"Potrero Mirador",339,29087,-93.101931069578,16.701349038322,"Avenida Segunda Sur Oriente, POTRERO MIRADOR, TUXTLA GUTIERREZ, CHIAPAS, 29087"
3E0D40BD-E8E7-43DD-85BC-7301E21C2B8E,16DD01CB-6BB5-491A-A654-154B191FF7DD,"Violencia familiar",1,Doloso,1,2025-05-04,17:47:00,8,1,5.1,Chiapas,7,Tonalá,97,"Cabeza de Toro",70970006,"Cabeza de Toro",9,30509,-93.788223266602,15.943359175324,"Tonalá, CABEZA DE TORO, TONALA, CHIAPAS, 30509"
33072424-5E58-4D81-8356-EF2668E92659,1737EE41-FDB5-4B27-A212-AF8B02A03C49,Homicidio,1,Doloso,1,2025-05-27,09:42:00,1,1,1.1.1,Chiapas,7,Tapachula,89,"Tapachula de Córdova y Ordóñez",70890001,Libertad,187,30796,-92.275457382202,14.879409966721,"Emiliano Zapata, LIBERTAD, TAPACHULA, CHIAPAS, 30796"
1D92B7B5-F039-4BE5-9D15-8A341E66C15C,175AA240-050E-4896-A62F-DB52EB36F580,"Fraude   ",1,Doloso,2,2025-01-29,12:34:00,8,1,4.2,Chiapas,7,Yajalón,109,Yajalón,71090001,Yajalón,32,29930,-92.331676483154,17.172738930985,"Yajalón, YAJALON, YAJALON, CHIAPAS, 29930"
463DB6E5-1EBD-4BF0-A373-739CE019E62A,176D0A46-E0EF-4915-AFBD-9A5FBA8B153C,"Desobediencia y resistencia de particulares",1,Doloso,1,2025-05-10,22:50:00,6,1,7.11.1,Chiapas,7,Tapachula,89,"Tapachula de Córdova y Ordóñez",70890001,"Tapachula Centro",325,30700,-92.264000583989,14.89185958981,"San José El Edén, TAPACHULA CENTRO, TAPACHULA, CHIAPAS, 30700"
FD1A570A-9288-45CC-8862-D1B0BED85CCE,1770B314-AB23-45E4-B100-F124E76E7B16,Lesiones,0,Culposo,1,2025-05-16,22:09:00,6,1,1.2.2,Chiapas,7,"Tuxtla Gutiérrez",101,"Tuxtla Gutiérrez",71010001,"Barrio San Francisco",565,29000,-93.118486404419,16.737453487559,"Copoya, BARRIO SAN FRANCISCO, TUXTLA GUTIERREZ, CHIAPAS, 29000"
8324F649-42D6-4423-889A-3CEF5EF826C9,179D82C9-1746-4CB2-9C62-416AD8CB1E0E,"Robo Otros",0,Doloso,2,2025-04-29,23:39:00,8,1,4.1.14,Chiapas,7,Reforma,74,Reforma,70740001,"Luis Donaldo Colosio Zona 6",28,29500,-93.161962734735,17.84953237319,"Reforma, LUIS DONALDO COLOSIO ZONA 6, REFORMA, CHIAPAS, 29500"
BBEF088A-0C72-4A64-AE64-9C101105B76F,17B553CB-AE3F-495D-A0BE-AD14E22EFB19,"Ataques a las vías de comunicación",1,Doloso,1,2025-05-03,02:59:00,8,1,7.10,Chiapas,7,"Tuxtla Gutiérrez",101,"Tuxtla Gutiérrez",71010001,"Jardines de Tuxtla",180,29020,-93.146166801453,16.755254844554,"Boulevard Doctor Belisario Domínguez, JARDINES DE TUXTLA, TUXTLA GUTIERREZ, CHIAPAS, 29020"
