ID_CI,ID_DELITO,DTO,DTO_PRIN,MODA_DTO,FORMA_ACC,FHA_DE_HCHOS,HRA_DE_HCHOS,EMTO_COM_DTO,GRDO_CONS,CLASF_DE_DTO,NOM_ENT_HCHOS,ID_ENT_HCHOS,NOM_MUN_HCHOS,ID_MUN_HCHOS,NOM_LOC_HCHOS,ID_LOC_HCHOS,NOM_COL_HCHOS,ID_COL_HCHOS,CP,COORD_X,COORD_Y,DOM_HCHOS
F0386F9F-4775-4315-AEDE-8228B149BC13,7834265D-627F-4167-B2F5-FB822B5B9EE6,"Robo de Vehículo",1,Doloso,2,2025-05-23,20:30:00,6,1,4.1.14,Chiapas,7,Ocosingo,59,Guadalupe,70592917,Guadalupe,32,29950,-92.099761962891,16.904027532884,"0 0, 0"
BB4C7833-89E6-47B8-A307-7F0883BA01F5,7839F2F7-3D18-4545-AE1C-52AC7D33B8FE,"Contra la salud (Narcomenudeo)",1,Doloso,2,2025-05-04,14:30:00,8,1,7.1.1,Chiapas,7,Chamula,23,Chamula,70230001,Chamula,7,29320,-92.688946723938,16.787938440897,"Calle Yaaljtotic, CHAMULA, CHAMULA, CHIAPAS, 29320"
3EAAD8F3-5348-43CC-818F-407825F8CF65,78526AF2-F8EF-43B9-9117-5F19BC11CA6E,Lesiones,1,Culposo,1,2025-05-01,11:40:00,4,1,1.2.2,Chiapas,7,"Chiapa de Corzo",27,"Juan del Grijalva",70270040,"Juan del Grijalva",91,29160,-92.984161376953,16.718540640254,"JUAN DEL GRIJALVA, CHIAPA DE CORZO, CHIAPAS, 29160"
FD8AA27B-1264-47E1-B11E-9772F05A05B2,787025CE-4C77-4006-8CC6-CC53E7F4F3C6,"Contra la salud (Narcomenudeo)",1,Doloso,2,2025-05-04,14:20:00,8,1,7.1.1,Chiapas,7,"Tuxtla Gutiérrez",101,"Tuxtla Gutiérrez",71010001,"Dr. Belisario Domínguez",116,29059,-93.159475922585,16.736582128854,"Avenida Coyatoc, DR BELISARIO DOMINGUEZ, TUXTLA GUTIERREZ, CHIAPAS, 29059"
00679E22-FF80-4B29-BF78-C425E70F746B,7967EC9F-6535-4FCB-9E0A-E97552EFD51B,"Robo a Negocio",1,Doloso,1,2025-05-18,18:15:00,1,1,4.1.11,Chiapas,7,"Tuxtla Gutiérrez",101,"Tuxtla Gutiérrez",71010001,"Las Terrazas",234,29060,-93.127509355545,16.744558870844,"Avenida 13a Sur Poniente, LAS TERRAZAS, TUXTLA GUTIERREZ, CHIAPAS, 29060"
F506F660-D007-4CF0-A629-DD6821155E6E,7A5DA87E-FF6C-4B53-B7F8-B3BC1A486152,Daños,1,Culposo,1,2024-11-01,19:05:00,8,1,4.5,Chiapas,7,"San Cristóbal de las Casas",78,"San Cristóbal de las Casas",70780001,"San Diego",146,29270,-92.634176015854,16.721389773193,"Calle Eje Vial Uno, SAN DIEGO, SAN CRISTOBAL DE LAS CASAS, CHIAPAS, 29270"
F8752601-018A-4629-98E2-F61395A9977F,7ABAC7BC-FA16-4B39-978D-53B2AB6C8901,"Contra la salud (Narcomenudeo)",1,Doloso,2,2025-05-11,13:23:00,8,1,7.1.1,Chiapas,7,Huixtla,40,Huixtla,70400001,"Huixtla Centro",32,30640,-92.461742162704,15.138170190982,"Calle Guerrero Oriente, HUIXTLA CENTRO, HUIXTLA, CHIAPAS, 30640"
7BE740AC-61B2-4D69-BF17-9B83EFEE293A,7AC5FC56-4C7F-4125-982C-2E4C2E0431B0,"Violencia familiar",1,Doloso,1,2025-01-22,10:49:00,8,1,5.1,Chiapas,7,Suchiapa,86,Suchiapa,70860001,Pacu,4,29150,-93.094367980957,16.623655316484,"Suchiapa PACU SUCHIAPA CHIAPAS 29150"
399459C0-E52B-4ED0-9A9F-3D3E0B8717E7,7AFDBE8E-89D0-4E12-8016-6C02BF19F4D5,Lesiones,1,Doloso,1,2025-05-01,17:48:00,2,1,1.2.1,Chiapas,7,"Tuxtla Gutiérrez",101,"Tuxtla Gutiérrez",71010001,"San José Terán",384,29057,-93.181400299072,16.746642217734,"2a Puente Norte, SAN JOSE TERAN, TUXTLA GUTIERREZ, CHIAPAS, 29057"
CD4D22C1-0831-4CF6-B572-8727801A272B,7B23C279-1679-452B-9896-58DD6D741C7D,"Desobediencia y resistencia de particulares",1,Doloso,2,2025-05-17,22:45:00,6,1,7.11.1,Chiapas,7,Arriaga,9,"Agua Zarca",70090197,"Arriaga Centro",3,30450,-93.90723824501,16.244350351991,"Calle Vigésima Segunda Norte, ARRIAGA CENTRO, ARRIAGA, CHIAPAS, 30450"
EE5E847E-E5D8-43B1-B03E-5684E8F77B4D,7B27AF67-CFA5-4CD5-AAA5-2B31027A09A8,Homicidio,1,Culposo,1,2025-05-26,05:13:00,4,1,1.1.2,Chiapas,7,Mapastepec,51,Mapastepec,70510001,"Nueva Sesecapa",66,30563,-92.837390899658,15.414923902599,"Sesecapa, NUEVA SESECAPA, MAPASTEPEC, CHIAPAS, 30563"
AA61FE63-6BE0-4B37-B301-B2703C651883,7B76C915-5975-4672-9F42-E9C8A257A05C,"Contra la salud (Narcomenudeo)",1,Doloso,2,2025-05-04,11:06:00,8,1,7.1.2,Chiapas,7,Tila,96,Petalcingo,70960055,Petalcingo,15,29915,-92.415084392342,17.225436045108,"Petalcingo, PETALCINGO, TILA, CHIAPAS, 29915"
B3CC9E2C-F76B-4035-B9D4-48495ACBB8C1,7B8CADBE-2529-4AC0-A730-67AB46D25C50,"Violencia familiar",1,Doloso,1,2025-05-08,06:50:00,2,1,5.1,Chiapas,7,Ocosingo,59,Ocosingo,70590001,"Otra colonia",-10,29950,-91.951274871826,16.82982836741,"Ocosingo, OTRA COLONIA, OCOSINGO, CHIAPAS, 29950"
8145C7BD-FE41-46B6-A64F-2D027A7D7FDD,7B97E525-284B-4D90-980E-24960C7F8F92,Ecocidio,1,Doloso,2,2025-05-02,16:20:00,8,1,7.7,Chiapas,7,"Las Margaritas",52,"Las Margaritas",70520001,Sacsalum,47,30187,-91.946750710849,16.344543017174,"Las Margaritas, SACSALUM, LAS MARGARITAS, CHIAPAS, 30187"
3FBE23C0-B2AC-4C1E-ABD3-81F918D9AF46,7CCF08DE-82BF-4948-ACAA-DE0D3C9DE3F3,Lesiones,1,Culposo,1,2023-02-27,00:15:00,4,1,1.2.2,Chiapas,7,Pijijiapan,69,Pijijiapan,70690001,Echegaray,8,30540,-93.173847198486,15.610766677012,"Nueva Coapa ECHEGARAY PIJIJIAPAN CHIAPAS 30540"
9BB847C6-AF14-43B5-8CE5-EE8038E67F11,7D533E7D-F6E6-4705-85E9-063A1C6A1455,"Contra la salud (Narcomenudeo)",1,Doloso,2,2025-05-09,20:52:00,8,1,7.1.1,Chiapas,7,Mazatán,54,Mazatán,70540001,"Otra colonia",-10,30650,-92.42205619812,14.86663488034,"El Aguacate, OTRA COLONIA, MAZATAN, CHIAPAS, 30650"
6A5D8847-EE93-4DD4-8DDB-4726F51EAD5B,7D63A8C8-9807-4FE2-B2BB-96FA2106B125,"Robo Otros",1,Doloso,1,2025-05-17,07:40:00,8,1,4.1.14,Chiapas,7,Mazatán,54,Mazatán,70540001,Mazatán,12,30650,-92.465727925301,14.840542583866,"19 de Abril, MAZATAN, MAZATAN, CHIAPAS, 30650"
DE6957F0-3E84-4CFD-B533-01CD3198F872,7D6C13DB-D2B6-4501-B41E-AA2C89B7C536,"Contra la salud (Narcomenudeo)",1,Doloso,2,2025-05-14,01:17:00,8,1,7.1.2,Chiapas,7,"Tuxtla Gutiérrez",101,"Tuxtla Gutiérrez",71010001,"24 de Junio",9,29047,-93.093456029892,16.765096452159,"Boulevard Fidel Velázquez, 24 DE JUNIO, TUXTLA GUTIERREZ, CHIAPAS, 29047"
552175A0-E76E-49DA-BE0B-AAC9FAFF4E39,7E1BA53B-64D3-4C0C-97C7-95173D1F3EC7,"Ataques a las vías de comunicación",1,Culposo,1,2025-05-08,18:50:00,8,1,7.10,Chiapas,7,"San Cristóbal de las Casas",78,"San Cristóbal de las Casas",70780001,"Anexo Morelos",232,29300,-92.638979073477,16.734857728564,"NO REFIERE 06, 00"
EB9C8227-C898-4C2A-98DA-413B4ED17B88,7E403044-08C3-4CDD-85AE-3B6A24BCFF94,Pederastia,1,Doloso,1,2025-04-13,09:32:00,3,1,3.7,Chiapas,7,"San Cristóbal de las Casas",78,"San Cristóbal de las Casas",70780001,"Huitepec las Palmas",208,29310,-92.689665555954,16.725633370707,"Las Flores, HUITEPEC LAS PALMAS, SAN CRISTOBAL DE LAS CASAS, CHIAPAS, 29310"
89666BA4-30B6-471B-85C3-FDE8C23172FD,7EA6DB17-F513-4A95-B724-04E90B295407,Estupro,1,Doloso,2,2025-05-29,16:38:00,8,1,3.7,Chiapas,7,"Tuxtla Gutiérrez",101,"Las Granjas",71010330,"Las Granjas",229,29019,-93.111190795898,16.75443409903,"Tuxtla Gutiérrez, LAS GRANJAS, TUXTLA GUTIERREZ, CHIAPAS, 29019"
AEA5FB60-1206-4F35-9D94-D31612348C75,7EB44111-B181-421A-9AFE-8DAAE827086C,"Contra la salud (Narcomenudeo)",1,Doloso,2,2025-05-01,11:38:00,8,1,7.1.2,Chiapas,7,"Tuxtla Gutiérrez",101,"Tuxtla Gutiérrez",71010001,"24 de Junio",9,29047,-93.093898709984,16.770503833204,"Avenida Río Cuxtepeques, 24 DE JUNIO, TUXTLA GUTIERREZ, CHIAPAS, 29047"
353BE9FA-8779-4744-B3CF-8964EED3961D,7EC5FADA-F751-47BC-A023-0565DB0173E9,Pederastia,1,Doloso,1,2025-05-16,08:00:00,3,1,3.7,Chiapas,7,"Chiapa de Corzo",27,"Chiapa de Corzo",70270001,"Otra colonia",-10,29174,-92.944464683533,16.67425528764,"San Carlos Nandaburé, OTRA COLONIA, CHIAPA DE CORZO, CHIAPAS, 29174"
9E2EBB13-48F5-4E24-804A-D72E75D71BB6,7ECFE499-26CD-4CFE-A3F9-33A557BDCBBE,"Contra la salud (Narcomenudeo)",1,Doloso,2,2025-05-14,19:23:00,8,1,7.1.1,Chiapas,7,Huixtla,40,"El Carmen",70400279,"El Carmen",20,30640,-92.470035552979,15.13738516427,"Las Hortencias, EL CARMEN, HUIXTLA, CHIAPAS, 30640"
67929610-77B4-47CA-A0FA-2C94026D2BD4,7F0E3712-44DC-4799-8D0C-2AB5F4D80091,"Violencia familiar",1,Doloso,1,2024-12-05,12:10:00,6,1,5.1,Chiapas,7,"Tuxtla Gutiérrez",101,"Tuxtla Gutiérrez",71010001,"15 de Mayo",3,29000,-93.11161137871,16.755423770142,"SINDATO SIN DATO"
9F37EFE5-1C95-40FB-B4CA-EC504719D72B,7F368B43-15ED-467D-8EDE-5A3ADCCDE356,Homicidio,1,Culposo,1,2025-05-17,14:48:00,8,1,1.1.2,Chiapas,7,Reforma,74,Reforma,70740001,"Luis Donaldo Colosio Zona 6",28,29500,-93.13196182251,17.85637672032,"Reforma, LUIS DONALDO COLOSIO ZONA 6, REFORMA, CHIAPAS, 29500"
7A784525-4D54-4CE2-8CCA-0FF3B71AC857,7F5F6852-50F1-4A58-B600-D6A18DAC4F6C,"Contra la salud (Narcomenudeo)",1,Doloso,2,2025-05-07,19:12:00,8,1,7.1.2,Chiapas,7,Tonalá,97,"Cabeza de Toro",70970006,"Cabeza de Toro",9,30500,-93.763289451599,16.088924253148,"CALLE PRINCIPAL SIN NUMERO, SIN NUMERO"
D821DBDE-3473-4B1C-904D-AE1C3F1C4591,7F8C4B9A-61AB-4798-97D4-A50620AE8A64,Extorsión,1,Doloso,2,2025-05-07,11:17:00,8,1,4.4.1,Chiapas,7,"San Cristóbal de las Casas",78,"San Cristóbal de las Casas",70780001,"Huitepec las Palmas",208,29310,-92.681157588959,16.727470328507,"Huitepec Santa Anita, HUITEPEC LAS PALMAS, SAN CRISTOBAL DE LAS CASAS, CHIAPAS, 29310"
53541DFD-5DC0-465B-8658-86ECD6840478,8009ABAC-BB48-4583-8644-C74CE8F6C0E5,"Robo a Transeúnte",1,Doloso,1,2025-05-11,19:02:00,2,1,4.1.5,Chiapas,7,"Tuxtla Gutiérrez",101,"Tuxtla Gutiérrez",71010001,"Plan de Ayala",333,29110,-93.163247108459,16.752637532029,"Buenos Aires, PLAN DE AYALA, TUXTLA GUTIERREZ, CHIAPAS, 29110"
B08477AC-DD85-463F-BE6E-290A101CFF63,8036E0A9-AD19-4E16-A09C-5FAE8A0CA5F9,"Violencia familiar",1,Doloso,1,2025-05-17,23:59:00,6,1,5.1,Chiapas,7,"Tuxtla Gutiérrez",101,"Tuxtla Gutiérrez",71010001,Terán,413,29050,-93.228950500488,16.753519765406,"Tuxtla Gutiérrez, TERAN, TUXTLA GUTIERREZ, CHIAPAS, 29050"
4BBB3D3C-83A8-4732-8B3A-80A242E9E3F5,806D0923-2BB7-4DF5-AFCF-5ADE22614E3D,Violación,1,Doloso,2,2024-10-12,12:40:00,3,1,3.8.1,Chiapas,7,"Tuxtla Gutiérrez",101,"Tuxtla Gutiérrez",71010001,"27 de Febrero",11,29045,-93.063363267388,16.76006458056,"Avenida Oscar Trinidad Palacios 27 DE FEBRERO TUXTLA GUTIERREZ CHIAPAS 29045"
E630384E-EF4C-4DEC-AA9C-127450DB9A85,80D80BB2-1B7A-4439-8402-6C8B9EFB6B76,"Robo a Transeúnte",1,Doloso,1,2025-04-30,23:25:00,2,1,4.1.6,Chiapas,7,"Tuxtla Gutiérrez",101,"Tuxtla Gutiérrez",71010001,"Francisco I. Madero",163,29096,-93.09834003685,16.729212978509,"Piedra Santa, FRANCISCO I MADERO, TUXTLA GUTIERREZ, CHIAPAS, 29096"
8C198C45-55E0-4A63-9897-91209BB317BE,80E2FD51-B76B-4BB6-BFFA-8C8CF3174DD0,"Robo a Negocio",1,Doloso,1,2025-05-23,20:12:00,1,1,4.1.11,Chiapas,7,"San Fernando",79,"San Fernando",70790001,"San Fernando",13,29120,-93.203115463257,16.865726464321,"Mauricio, OTRA COLONIA, SAN FERNANDO, CHIAPAS, 29120"
AAA3CA7A-A8EF-47B4-86AD-4FCABBF402CB,81057BCE-2A01-4631-B10F-E92688CBC295,"Ataques a las vías de comunicación",1,Culposo,1,2025-05-10,23:39:00,8,1,7.10,Chiapas,7,"Tuxtla Gutiérrez",101,"Tuxtla Gutiérrez",71010001,"6 de Junio III",17,29000,-93.132180900618,16.751949351016,"8a. NORTE ESQUINA 6A. PONIENTE, NUMERO 906, COLONIA COLON 906, S/N"
F12FD804-36CB-47E5-8105-E63E512DA0CA,81FD6CDD-E47B-4663-A335-06F473B53A27,Amenazas,1,Doloso,1,2025-04-22,16:40:00,8,1,7.2,Chiapas,7,"Tuxtla Gutiérrez",101,"Tuxtla Gutiérrez",71010001,"Patria Nueva de Sabines",326,29045,-93.074712753296,16.752871975996,"Calle Abedul Sur, PATRIA NUEVA DE SABINES, TUXTLA GUTIERREZ, CHIAPAS, 29045"
31822D6F-7AE1-4655-B17B-91E6A980BF16,8231D00A-4702-44D1-A1B5-A9F86967BD28,Violación,1,Doloso,1,2025-05-09,12:55:00,3,1,3.8.1,Chiapas,7,"Tuxtla Gutiérrez",101,"Tuxtla Gutiérrez",71010001,"Cruz Con Casita",111,29019,-93.101138599393,16.783174688046,"Avenida Malpaso CRUZ CON CASITA TUXTLA GUTIERREZ CHIAPAS 29019"
CA2B558D-775E-4627-9892-0F6609190D93,8268DD44-6327-4DE1-9535-AE3DB28D8110,"Abuso sexual",1,Doloso,2,2025-03-11,10:51:00,8,2,3.1,Chiapas,7,Ixtapa,44,Ixtapa,70440001,Ixtapa,12,29340,-92.903491258621,16.803338279873,"Calle Segunda Oriente Norte, IXTAPA, IXTAPA, CHIAPAS, 29340"
3CEEC179-DFC1-4702-A235-5AA9891547C6,833B9F5D-3F5B-4279-949A-733C7B2959AD,"Ataques a las vías de comunicación",1,Culposo,1,2025-05-02,22:37:00,8,1,7.10,Chiapas,7,Ocosingo,59,Ocosingo,70590001,"Ocosingo Centro",76,29950,-92.093238830566,16.905705898173,"Los Pinos, OCOSINGO CENTRO, OCOSINGO, CHIAPAS, 29950"
E091FDE2-1D63-485E-B74D-A1872BAD3B4D,8372AB5E-6D09-48A7-9E3F-47C0B4D2E87D,"Desaparición cometida por particulares",1,Doloso,2,2025-05-06,08:12:00,8,1,2.7.4,Chiapas,7,Tapachula,89,"Tapachula de Córdova y Ordóñez",70890001,"Toquian Grande",338,30700,-92.257690429688,14.903864576355,"Framboyanes, TOQUIAN GRANDE, TAPACHULA, CHIAPAS, 30700"
7995C955-89AB-4904-B67E-75FD330EB8A2,837ED0CE-AAEF-455F-B5B0-2C0B26F22163,"Contra la salud (Narcomenudeo)",1,Doloso,2,2025-05-02,18:43:00,8,1,7.1.2,Chiapas,7,"Villa Corzo",107,"Revolución Mexicana",71070200,"Revolución Mexicana",71,30533,-93.074388089053,16.173396068617,"Revolución Mexicana, REVOLUCION MEXICANA, VILLA CORZO, CHIAPAS, 30533"
682E2561-A567-4532-ACE2-C3DB54AF6214,83B6FC5D-C703-476D-AAA2-19B82BD5E3EE,Lesiones,0,Culposo,1,2025-05-09,23:16:00,4,1,1.2.2,Chiapas,7,"Tuxtla Gutiérrez",101,"Tuxtla Gutiérrez",71010001,Calvarium,83,29000,-93.118228912354,16.753720097306,"NINGUNA 21, S/N"
89D0CB4B-29F3-494A-A40C-F4D885AC830E,83CE7A52-BFE3-4AAD-B43E-F8897DD54C26,"Encubrimiento por receptación",1,Doloso,2,2025-05-20,23:40:00,8,1,4.7,Chiapas,7,"San Cristóbal de las Casas",78,"San Cristóbal de las Casas",70780001,"Nueva Palestina",124,29242,-92.64066696167,16.736624350006,"Vistahermosa Huitepec, NUEVA PALESTINA, SAN CRISTOBAL DE LAS CASAS, CHIAPAS, 29242"
9FE83EF6-8515-47C9-9DD2-664730233D7D,84CC6883-9D19-40FB-94A2-69B61B09551A,Lesiones,0,Doloso,1,2025-05-14,18:24:00,2,1,1.2.1,Chiapas,7,"Chiapa de Corzo",27,"Chiapa de Corzo",70270001,"Barrio Covadonga",75,29160,-93.019094467163,16.715937112693,"San Pedro, BARRIO COVADONGA, CHIAPA DE CORZO, CHIAPAS, 29160"
45D2133E-52AD-4ABD-AB0E-3EF60EF39E80,84E2AAE2-D19F-4BE1-A040-82C8831A801B,"Robo de Vehículo",1,Doloso,1,2025-05-07,11:48:00,6,1,4.1.2.1,Chiapas,7,Pijijiapan,69,Pijijiapan,70690001,"Otra colonia",-10,30540,-93.208093643188,15.683484372434,"Pijijiapan OTRA COLONIA PIJIJIAPAN CHIAPAS"
DCD81303-B214-4FE1-8B55-CB3FCECF11F0,852884A0-AC97-4E84-B9D7-3D40B1B1EF87,"Robo de Vehículo",1,Doloso,2,2025-05-25,19:22:00,6,1,4.1.2.2,Chiapas,7,"San Cristóbal de las Casas",78,"San Cristóbal de las Casas",70780001,"Bosques del Pedregal",24,29213,-92.650545537472,16.753388217221,"Calle Diamante BOSQUES DEL PEDREGAL SAN CRISTOBAL DE LAS CASAS CHIAPAS 29213"
F817A7A9-8D4A-4902-A4EF-A918D2D0AF94,860E6E80-B2E9-4C36-843D-C8B2ADE6E0E0,"Robo Otros",1,Doloso,2,2024-01-08,09:30:00,8,1,4.1.14,Chiapas,7,Villaflores,108,"Jesús María Garza",71080120,"Jesús María Garza",31,30484,-93.309416770935,16.408459242396,"Benito Juárez, JESUS MARIA GARZA, VILLAFLORES, CHIAPAS, 30484"
B8274C1B-4741-410B-91D3-B57747B9EF3C,8659B9F8-49F8-417B-9683-7092FCE984CB,Extorsión,1,Doloso,1,2025-03-03,14:00:00,8,1,4.4.1,Chiapas,7,Tapachula,89,"Buenos Aires",70890489,"Buenos Aires",46,30700,-92.259435961608,14.904876946499,"SIN DATOS 13, 1"
D4CB1239-256A-41B0-973D-384C578E4FC0,865AF4B5-050F-4652-BD3C-A1578B86D324,Lesiones,1,Doloso,1,2025-05-24,22:49:00,2,1,1.2.1,Chiapas,7,"Tuxtla Gutiérrez",101,"Tuxtla Gutiérrez",71010001,"Nueva Esperanza",475,29000,-93.115310668945,16.754706343586,"Copoya, NUEVA ESPERANZA, TUXTLA GUTIERREZ, CHIAPAS, 29000"
9B254D2C-D464-4A0C-B316-E259845D4785,866B6E96-FB60-4F3B-80E7-327036ACC3E4,"Desobediencia y resistencia de particulares",1,Doloso,2,2025-05-04,08:08:00,6,1,7.11.1,Chiapas,7,"Tuxtla Gutiérrez",101,"Tuxtla Gutiérrez",71010001,"SATELITE LOMA LARGA",601,29045,-93.059268593788,16.743476092944,"Calle Sagitario, SATELITE LOMA LARGA, TUXTLA GUTIERREZ, CHIAPAS, 29045"
861BCD00-B001-47AF-8965-D83EE2515F30,86830A46-2576-4B73-986D-DE5CB576F673,Discriminación,1,Doloso,2,2024-04-03,12:31:00,8,1,6.3,Chiapas,7,"Tuxtla Gutiérrez",101,"Tuxtla Gutiérrez",71010001,"Los Choferes",257,29000,-93.082394599915,16.747073717153,"Boulevard Ángel Albino Corzo, Tuxtla Gutiérrez, Chiapas, 29077, México"
DB7BDC03-3F8D-40EB-B8D0-9AC54D0D53C0,8699F707-8813-4601-B3A8-A87D74ED4469,"Robo de Vehículo",1,Doloso,1,2025-05-05,13:00:00,1,1,4.1.2.2,Chiapas,7,Mapastepec,51,Mapastepec,70510001,"El Llanito",24,30560,-92.884601527595,15.456155897144,"Mapastepec, EL LLANITO, MAPASTEPEC, CHIAPAS, 30560"
E3EAE4EC-C6A3-40CE-AC09-BA85F0A5D950,86F47045-8A51-4569-BBEA-35BEA5C8E4EB,"Violencia familiar",1,Doloso,1,2025-05-09,17:18:00,8,1,5.1,Chiapas,7,"Tuxtla Gutiérrez",101,Copoya,71010037,Copoya,107,29100,-93.119387626648,16.750690054795,"Calle 3a Poniente Sur, COPOYA, TUXTLA GUTIERREZ, CHIAPAS, 29100"
1ABEF8A1-2A1E-4DE2-B7B2-7C7B39942069,873896AA-7D81-4AE2-A770-385020A59255,"Desobediencia y resistencia de particulares",1,Doloso,1,2025-05-30,13:25:00,6,1,7.11.1,Chiapas,7,Palenque,65,Palenque,70650001,"Palenque Centro",67,29960,-91.991100311279,17.508158703364,"Pakal-Ná, PALENQUE CENTRO, PALENQUE, CHIAPAS, 29960"
5174D503-290B-4340-B5D0-3B2EA5353F63,87EFA132-6AA7-4195-B35F-45E606B452EA,"Contra la salud (Narcomenudeo)",1,Doloso,2,2025-05-28,23:59:00,8,1,7.1.2,Chiapas,7,Tecpatán,92,Tecpatán,70920001,"Otra colonia",-10,29610,-93.298516273499,17.132169292201,"OTRA COLONIA, TECPATAN, CHIAPAS, 29610"
A6CF578E-6E2B-4F6D-9460-E1B8D2F6FE98,88AF808E-A107-4A1F-ABAF-F2B3BFC666D2,"Desobediencia y resistencia de particulares",1,Doloso,2,2025-05-30,18:12:00,6,1,7.11.1,Chiapas,7,"Tuxtla Gutiérrez",101,"Tuxtla Gutiérrez",71010001,Democrática,441,29090,-93.109431266785,16.789311103868,"Copoya, DEMOCRATICA, TUXTLA GUTIERREZ, CHIAPAS, 29090"
BE6E97DC-5EDB-4E2D-83FA-B2A24908A8B7,88C5F583-8962-4AF6-8350-1031A83F17D9,"Robo de Vehículo",1,Doloso,2,2025-04-01,16:30:00,6,1,4.1.2.1,Chiapas,7,"Tuxtla Gutiérrez",101,"Tuxtla Gutiérrez",71010001,"El Retiro",138,29040,-93.081667721272,16.747642707359,"Plaza Polyforum, EL RETIRO, TUXTLA GUTIERREZ, CHIAPAS, 29040"
3BF31898-BFE5-44EC-8752-026F595317B0,89BB625A-B411-4AD4-9380-AFDBFA117EC0,Lesiones,1,Doloso,1,2024-11-16,11:25:00,6,1,1.2.1,Chiapas,7,"San Cristóbal de las Casas",78,"Las Peras",70780174,"Las Peras",187,29256,-92.616575727858,16.714750293315,"Periférico Oriente Sur, LAS PERAS, SAN CRISTOBAL DE LAS CASAS, CHIAPAS, 29256"
22B4623D-0B9A-40FE-BD56-2599A3859BDA,89DF2DAD-EB8E-4E92-8585-29F4698E8E88,"Contra la salud (Narcomenudeo)",1,Doloso,2,2025-05-05,15:00:00,8,1,7.1.2,Chiapas,7,"Villa Corzo",107,"Villa Corzo",71070001,"San Pedro  Buenavista",91,30523,-93.159402676313,16.137354849449,"Calle Sexta Oriente Norte, SAN PEDRO  BUENAVISTA, VILLA CORZO, CHIAPAS, 30523"
F69E7E05-547C-4079-AE5E-270A85F9B7E5,8A0326EB-68F1-4C15-B06D-36D640825FDC,Lesiones,1,Culposo,1,2025-05-23,21:52:00,4,1,1.2.2,Chiapas,7,Tapachula,89,"Tapachula de Córdova y Ordóñez",70890001,"San Sebastián",308,30790,-92.261470059452,14.904905167774,"Fovi Banamex, SAN SEBASTIAN, TAPACHULA, CHIAPAS, 30790"
BC1C98F0-BD71-4D80-B5F8-B8E366BF930E,8A602F99-3C5B-40B3-AEDD-951513376F12,Daños,1,Doloso,1,2025-05-10,02:39:00,8,1,4.5,Chiapas,7,"Tuxtla Gutiérrez",101,"Tuxtla Gutiérrez",71010001,"16 de Julio",4,29049,-93.111362457275,16.753720097306,"Copoya, 16 DE JULIO, TUXTLA GUTIERREZ, CHIAPAS, 29049"
798C2850-6CCF-4107-9CEC-E4CEAAE67BDC,8A82D61C-FF2B-46A4-A71A-5998C347B2D3,Lesiones,1,Doloso,1,2025-05-10,17:00:00,2,1,1.2.1,Chiapas,7,Sabanilla,76,Sabanilla,70760001,"Otra colonia",-10,29910,-92.426776885986,17.302588086127,"Tila OTRA COLONIA SABANILLA CHIAPAS 29910"
E6AD6B4B-714A-433E-A131-AADE258B495D,8AD20F4F-96E8-4D41-A720-B5F53AE600C9,Daños,0,Doloso,1,2025-05-10,21:50:00,8,1,4.5,Chiapas,7,"Tuxtla Gutiérrez",101,"Tuxtla Gutiérrez",71010001,"Ampliacion San Pedro Progresivo",490,29000,-93.12629699707,16.740626166403,"Tuxtla Gutiérrez, AMPLIACION SAN PEDRO PROGRESIVO, TUXTLA GUTIERREZ, CHIAPAS, 29000"
2B52DADF-32E6-463D-AD9C-599BB7F286A9,8B15409E-CB2D-43BF-809D-2CBBB8D61813,"Armas prohibidas",0,Doloso,2,2025-05-05,13:17:00,8,1,7.10,Chiapas,7,"Chiapa de Corzo",27,"Chiapa de Corzo",70270001,"El Nipe",15,29160,-93.013987541199,16.73018286728,"Calle Jazmin EL NIPE CHIAPA DE CORZO CHIAPAS 29160"
CC50B886-6011-47FB-AAD3-4F2F7AC42672,8B32605E-50D6-462A-84D9-AF9F498BB95B,"Violencia familiar",1,Doloso,1,2025-03-05,23:00:00,6,1,5.1,Chiapas,7,"Tuxtla Gutiérrez",101,"Tuxtla Gutiérrez",71010001,"PLAN DE AYALA AMPLIACIÓN NORTE",596,29000,-93.188717365265,16.770023966881,"Avenida Chihuahua, PLAN DE AYALA AMPLIACION NORTE, TUXTLA GUTIERREZ, CHIAPAS, 29000"
CDFAF379-8526-4536-8578-449D781AA145,8BC02FE4-2FA4-4B22-9AFA-D621649DF2D2,"Fraude   ",1,Doloso,2,2018-05-16,10:00:00,8,1,4.2,Chiapas,7,"San Cristóbal de las Casas",78,"San Cristóbal de las Casas",70780001,"Peje de Oro",130,29000,-92.621129751205,16.742077863598,"SIN DATO PEJE DE ORO SAN CRISTOBAL DE LAS CASAS CHIAPAS 29000"
F90EAB6C-DB43-46E8-80A4-94DC77122672,8BD14D4A-21DD-4550-8E4D-9739957E039C,Lesiones,1,Doloso,1,2024-07-26,14:00:00,2,1,1.2.1,Chiapas,7,"San Juan Cancuc",112,"San Juan Cancuc",71120001,Chilolja,4,29790,-92.37133026123,16.891216032251,"San Juan Cancuc, Chiapas, México"
5EEC2FA5-1E63-463A-AB03-043E3C559E0D,8C1B3C3A-AAFF-419E-904D-1E4209C94878,"Acoso Sexual",1,Doloso,2,2020-12-15,14:30:00,8,1,3.2,Chiapas,7,Chenalhó,26,Chenalhó,70260001,Chenalho,2,29870,-92.62305021286,16.905560902373,"Bachen CHENALHO CHENALHO CHIAPAS 29870"
4BDA28AB-1799-4803-9352-9F956F7D7179,8C884EC5-243E-474E-82AA-8BC62E7B2650,"Contra la salud (Narcomenudeo)",1,Doloso,2,2025-05-16,13:44:00,8,1,7.1.2,Chiapas,7,"San Cristóbal de las Casas",78,"San Cristóbal de las Casas",70780001,"14 de Septiembre",4,29210,-92.643413543701,16.738268238545,"Vistahermosa Huitepec, 14 DE SEPTIEMBRE, SAN CRISTOBAL DE LAS CASAS, CHIAPAS, 29210"
D031651E-1B61-4313-8002-F38936665845,8C979C80-835A-4CDC-A65E-7AF75D58E5F7,"Abuso sexual",1,Doloso,1,2024-12-28,21:30:00,8,1,3.1,Chiapas,7,Berriozábal,12,"La Libertad",70120306,"La Libertad",45,29134,-93.243112564087,16.801081110137,"San Miguel, LA LIBERTAD, BERRIOZABAL, CHIAPAS, 29134"
39E60694-E2CF-4C67-BEBA-ECCDDBD4858D,8CB25D3B-FE0A-4A24-9751-9C6AC45DEC0D,"Fraude   ",1,Doloso,2,2022-12-10,11:44:00,8,1,4.2,Chiapas,7,"Tuxtla Gutiérrez",101,"Tuxtla Gutiérrez",71010001,"Otra colonia",-10,29000,-93.112564086914,16.745228921868,"NOTARIA PUBLICA NUMERO 178 DEL ESTADO DE CHIAPAS."
C6E3A03A-8643-4FB4-8815-92B833B63730,8D16D559-AB25-486C-8A14-8E1455CA00E4,Homicidio,1,Culposo,1,2025-05-02,20:35:00,4,1,1.1.2,Chiapas,7,"San Cristóbal de las Casas",78,"San Cristóbal de las Casas",70780001,"San Ramón",161,29240,-92.651197314262,16.73979082949,"Prolongación Puebla, SAN RAMON, SAN CRISTOBAL DE LAS CASAS, CHIAPAS, 29240"
451FDF04-A980-489F-A870-AE479DA43DDA,8D2A2DBB-EE52-429A-9846-EB9FE91B8273,Pederastia,1,Doloso,1,2025-05-05,12:36:00,6,1,3.7,Chiapas,7,Bochil,13,Bochil,70130001,"El Trapiche",16,29770,-92.89137840271,16.997653234074,"Avenida 2da. Norte Poniente, EL TRAPICHE, BOCHIL, CHIAPAS, 29770"
BEE28178-6ADE-462F-8E93-9ABC63E7329A,8D9DE320-BD72-49F6-9EE4-462FD059FC9F,"Delitos electorales cometidos por cualquier persona",1,Doloso,1,2024-06-11,16:31:00,8,1,7.9,Chiapas,7,"Bella Vista",11,"Las Chicharras",70110019,"Las Chicharras",16,30134,-92.245258390904,15.583350643249,"Calle Central Poniente, Bella Vista, Chiapas, México"
8EFA23DC-B534-4C16-8197-78A96259BEE6,8DE1CF2C-6C49-4F55-84C3-7F6A771649FE,Lesiones,1,Culposo,1,2025-05-27,09:55:00,4,1,1.2.2,Chiapas,7,"Las Margaritas",52,"Vicente Guerrero",70520183,"Vicente Guerrero",69,30185,-91.946983337402,16.366391162581,"San José el Puente, VICENTE GUERRERO, LAS MARGARITAS, CHIAPAS, 30185"
1C45DBD2-D225-46CE-A765-FB3B2DD17590,8DF0D2EF-38B3-443C-9794-BEB098A7037A,"Desobediencia y resistencia de particulares",1,Doloso,1,2025-05-16,16:02:00,6,1,7.11.1,Chiapas,7,"San Cristóbal de las Casas",78,"San Cristóbal de las Casas",70780001,"San Cristóbal de las Casas Centro",145,29200,-92.637748718262,16.736295570596,"Vistahermosa Huitepec, SAN CRISTOBAL DE LAS CASAS CENTRO, SAN CRISTOBAL DE LAS CASAS, CHIAPAS, 29200"
FB1EB421-BFAE-40A5-ACEF-F62BC7CFA40D,8DF0DA51-D4C2-482F-AA3C-FD169607108D,Homicidio,1,Culposo,1,2025-05-10,16:57:00,6,1,1.1.2,Chiapas,7,Palenque,65,"San Miguel",70651164,"San Miguel",77,29960,-92.326698303223,17.553300964117,"SAN MIGUEL PALENQUE CHIAPAS 29960"
8F7C2FF3-7041-4EB8-AD48-B01E93F087B3,8DF34422-92A4-47AB-98CD-82DD7F618D1E,"Robo Otros",1,Doloso,2,2024-11-13,11:22:00,8,1,4.1.14,Chiapas,7,"Tuxtla Gutiérrez",101,"Tuxtla Gutiérrez",71010001,"16 de Julio",4,29049,-93.159674406052,16.750589566227,"Calle 7a Oriente sur, 16 DE JULIO, TUXTLA GUTIERREZ, CHIAPAS, 29049"
939793D8-8B53-4981-A425-A408E2393D1A,8E15A89A-32E9-422A-96E4-FA03A2455145,Lesiones,0,Culposo,1,2025-05-12,18:08:00,4,1,1.2.2,Chiapas,7,Suchiate,87,"Benito Juárez",70870245,"Benito Juárez",12,30846,-92.26787572507,14.637165969686,"Entrada Jaritas-Ciudad Hidalgo, BENITO JUAREZ, SUCHIATE, CHIAPAS, 30846"
991CB58E-30D7-455C-81BB-D22525FE2872,8E3A4BC2-D5D2-43D2-A105-B56E6A7B4036,"Incumplimiento de obligaciones de asistencia familiar",1,Doloso,2,2025-02-10,09:22:00,8,1,5.3,Chiapas,7,"Comitán de Domínguez",19,"Comitán de Domínguez",70190001,Jerusalem,66,30015,-92.128145098686,16.267366628294,"Comitán, JERUSALEM, COMITAN DE DOMINGUEZ, CHIAPAS, 30015"
EC671818-22F6-4315-9799-342408DC744D,8E756BA7-551A-4805-86BA-207818D91DC0,"Contra la salud (Narcomenudeo)",1,Doloso,2,2025-05-15,17:31:00,8,1,7.1.2,Chiapas,7,Tuzantán,103,Tuzantán,71030001,Tuzantan,9,30680,-92.424555442219,15.148105673939,"Tuzantán, TUZANTAN, TUZANTAN, CHIAPAS, 30680"
D81AF898-21CD-4D31-B38A-625C2CDE6224,8E7D3C00-8BFB-47F8-BEA5-7B32FAA442B9,Lesiones,1,Doloso,1,2025-05-05,19:53:00,2,1,1.2.1,Chiapas,7,"San Cristóbal de las Casas",78,"San Cristóbal de las Casas",70780001,"San Cristóbal de las Casas Centro",145,29200,-92.641868591309,16.736788739498,"Vistahermosa Huitepec, SAN CRISTOBAL DE LAS CASAS CENTRO, SAN CRISTOBAL DE LAS CASAS, CHIAPAS, 29200"
457C35C7-F680-4500-9CBF-707944A0CC8A,8F309890-9311-4076-B6AB-C0F7EDD9B912,"Robo a Casa Habitación",1,Doloso,1,2025-05-03,21:43:00,1,1,4.1.1,Chiapas,7,"Tuxtla Gutiérrez",101,"Tuxtla Gutiérrez",71010001,Montecristo,472,29050,-93.161315917969,16.759108432627,"Copoya, MONTECRISTO, TUXTLA GUTIERREZ, CHIAPAS, 29050"
