ID_CI,ID_DELITO,DTO,DTO_PRIN,MODA_DTO,FORMA_ACC,FHA_DE_HCHOS,HRA_DE_HCHOS,EMTO_COM_DTO,GRDO_CONS,CLASF_DE_DTO,NOM_ENT_HCHOS,ID_ENT_HCHOS,NOM_MUN_HCHOS,ID_MUN_HCHOS,NOM_LOC_HCHOS,ID_LOC_HCHOS,NOM_COL_HCHOS,ID_COL_HCHOS,CP,COORD_X,COORD_Y,DOM_HCHOS
3DFEA433-EA25-4BA8-B1F2-44D195553950,C1C0D7AD-411F-447D-8A97-7A447E22DC1B,"Contra la salud (Narcomenudeo)",0,Doloso,2,2025-05-07,12:18:00,8,1,7.1.2,Chiapas,7,Mapastepec,51,Mapastepec,70510001,"Mapastepec Centro",58,30560,-92.894811630249,15.442162673928,"Mapastepec, MAPASTEPEC CENTRO, MAPASTEPEC, CHIAPAS, 30560"
9AC5CCA8-493C-4B3B-B906-343619B9FE06,C24CDEC9-2E14-419D-8AAC-BCAECCEA0F50,Ecocidio,1,Doloso,2,2025-05-12,18:40:00,8,1,7.7,Chiapas,7,"Las Margaritas",52,"Las Margaritas",70520001,"Barrio Centro",33,30187,-91.978815793991,16.315802311647,"Calle Tercera Sur Oriente, BARRIO CENTRO, LAS MARGARITAS, CHIAPAS, 30187"
13DC2DEF-B902-46C1-BE36-3C18DD334667,C2B32C7B-593A-4D14-8F81-1846F2431481,"Violencia familiar",1,Doloso,1,2025-02-19,03:00:00,6,1,5.1,Chiapas,7,Cintalapa,17,"Cintalapa de Figueroa",70170001,Insurgentes,19,30400,-93.721446990967,16.690918575189,"Cintalapa, INSURGENTES, CINTALAPA DE FIGUEROA, CHIAPAS, 30400"
C3B23B47-F7C2-4E8A-987F-201AEB202E80,C2BD5966-B65E-4D6B-8DC9-73B97CE2ADF1,"Abuso de autoridad",1,Doloso,2,2023-12-22,08:20:00,6,1,7.8,Chiapas,7,"San Cristóbal de las Casas",78,"San Cristóbal de las Casas",70780001,Salsipuedes,142,29296,-92.62765288353,16.716868645322,"Calzada de las Américas, Colonia Salsipuedes, San Cristóbal, San Cristóbal de las Casas, Chiapas, 29200, México"
D70D4A8F-6975-4786-9F08-E61FBC73DD83,C2CBB0A9-E211-42CF-B3E0-F6A486693465,Daños,1,Culposo,1,2025-05-25,20:05:00,8,1,4.5,Chiapas,7,Ocosingo,59,"Santo Domingo",70591642,"Santo Domingo",104,29950,-92.094154358347,16.910484281425,"Ocosingo, SANTO DOMINGO, OCOSINGO, CHIAPAS, 29950"
282D7C43-9A76-42D2-ADB0-ADFC3C3AB67B,C312C687-E4D7-4B35-B336-3A24657F54B1,"Robo de Vehículo",1,Doloso,2,2025-05-06,02:20:00,6,2,4.1.2.2,Chiapas,7,"San Cristóbal de las Casas",78,"San Cristóbal de las Casas",70780001,"San Cristóbal de las Casas Centro",145,29200,-92.642726898193,16.735144838194,"Vistahermosa Huitepec, SAN CRISTOBAL DE LAS CASAS CENTRO, SAN CRISTOBAL DE LAS CASAS, CHIAPAS, 29200"
F3E592B8-0898-4F13-8362-4B1BF29B5797,C3E90096-BF6C-4A12-AD0D-E7990467C7BD,"Contra la salud (Narcomenudeo)",1,Doloso,2,2025-05-17,15:40:00,8,1,7.1.1,Chiapas,7,Tapachula,89,"Tapachula de Córdova y Ordóñez",70890001,Seminarista,323,30780,-92.263698577881,14.907593878766,"Framboyanes, SEMINARISTA, TAPACHULA, CHIAPAS, 30780"
9FE83EF6-8515-47C9-9DD2-664730233D7D,C3FBBA08-14C4-4E89-82CB-BE2A72428FCF,"Robo a Transeúnte",1,Doloso,1,2025-05-14,18:24:00,8,1,4.1.5,Chiapas,7,"Chiapa de Corzo",27,"Chiapa de Corzo",70270001,"Barrio Covadonga",75,29160,-93.019094467163,16.715937112693,"San Pedro, BARRIO COVADONGA, CHIAPA DE CORZO, CHIAPAS, 29160"
6A8F536A-0869-49D7-A5CD-DFD078533160,C446D503-1D3C-4E6F-ACE9-C57F144863FC,"Desobediencia y resistencia de particulares",0,Doloso,1,2025-05-28,18:07:00,6,1,7.11.1,Chiapas,7,Huixtla,40,Huixtla,70400001,"Vida Mejor San Vicente",61,30640,-92.461280822754,15.130591144278,"Las Hortencias, VIDA MEJOR SAN VICENTE, HUIXTLA, CHIAPAS, 30640"
E880E22F-DFDB-4A08-BD00-6205F3017DCB,C454C568-9CEE-4D8B-A185-908F7F51ED00,Amenazas,1,Doloso,1,2024-11-06,10:55:00,8,1,7.2,Chiapas,7,Yajalón,109,Yajalón,71090001,"Barrio Chul-Ha",7,29930,-92.330442667007,17.173561854785,"Avenida Cuarta Norte Oriente, BARRIO CHULHA, YAJALON, CHIAPAS, 29930"
366D484B-8E41-4FB1-AF48-40B23D4C8B67,C4D81D56-16FA-4518-95BA-DC3B13176CDC,"Robo de Vehículo",1,Doloso,1,2025-05-20,13:12:00,6,2,4.1.2.2,Chiapas,7,Mapastepec,51,Mapastepec,70510001,"Otra colonia",-10,30560,-92.900132983813,15.429764257742,"Mapastepec, OTRA COLONIA, MAPASTEPEC, CHIAPAS, 30560"
CD4FDB39-A5A9-4C62-B782-819BB1B4C8B5,C593BC4E-74D6-4803-8498-2D571D7F589F,"Robo a Negocio",1,Doloso,1,2025-05-05,14:00:00,1,2,4.1.11,Chiapas,7,"Tuxtla Gutiérrez",101,"Tuxtla Gutiérrez",71010001,"Albania Alta",27,29010,-93.109436631203,16.776624861288,"Avenida 20 de Noviembre, ALBANIA ALTA, TUXTLA GUTIERREZ, CHIAPAS, 29010"
D80641F7-124E-43F2-A3ED-22319576675F,C5E6D4F5-C93F-4F2A-95A7-B8368E4E9099,"Contra la salud (Narcomenudeo)",1,Doloso,2,2025-05-16,17:03:00,8,1,7.1.2,Chiapas,7,Tapachula,89,"Tapachula de Córdova y Ordóñez",70890001,"Ciudad de Tapachula",61,30709,-92.263903392312,14.900870321731,"Tapachula, CIUDAD DE TAPACHULA, TAPACHULA, CHIAPAS, 30709"
E27D35C3-838D-4083-AB47-4ECFF2AC569D,C5FBC256-198A-4C44-9BA2-06020B542BCD,Homicidio,1,Doloso,1,2025-05-04,08:00:00,1,1,1.1.1,Chiapas,7,"Benemérito de las Américas",114,"Benemérito de las Américas",71140001,"Benemérito de las Américas",1,29955,-90.651454925537,16.48435728313,"Benemérito de las Américas, BENEMERITO DE LAS AMERICAS, BENEMERITO DE LAS AMERICAS, CHIAPAS, 29955"
B5C10FBD-4676-41CC-9F7A-DF082CFDB13B,C6036C0D-1322-4657-859C-24C0F63E29A7,Homicidio,1,Doloso,1,2025-05-18,01:42:00,6,1,1.1.1,Chiapas,7,"Tuxtla Gutiérrez",101,"Tuxtla Gutiérrez",71010001,"La Condesa",193,29018,-93.12120616436,16.788504740955,"Calle Escorpión, LA CONDESA, TUXTLA GUTIERREZ, CHIAPAS, 29018"
B606D0A7-88A8-4805-9528-F720CB6908EB,C61A77D0-04C3-42D2-A78B-8A74F4E10613,"Contra la salud (Narcomenudeo)",1,Doloso,2,2025-05-02,19:05:00,8,1,7.1.1,Chiapas,7,"Tuxtla Gutiérrez",101,"Tuxtla Gutiérrez",71010001,Democrática,441,29019,-93.11181306839,16.792872103896,"Avenida Ágata, DEMOCRATICA, TUXTLA GUTIERREZ, CHIAPAS, 29019"
7DFEF80D-398C-478C-9989-F720A9757312,C71F12C1-FA0F-43FA-8110-2F0C4884D4E1,Pederastia,1,Doloso,2,2025-03-24,15:14:00,6,1,3.7,Chiapas,7,Reforma,74,Reforma,70740001,"Reforma Centro",37,29500,-93.159045420751,17.856721870547,"El Carmen (El Limón), REFORMA CENTRO, REFORMA, CHIAPAS, 29500"
D0C0075E-5E9B-4CCB-BEBD-5631D25E7F4A,C72D582C-F405-400D-A26F-299A6129028F,Feminicidio,1,Doloso,1,2025-05-22,02:31:00,2,2,1.3,Chiapas,7,"Tuxtla Gutiérrez",101,"Tuxtla Gutiérrez",71010001,"Tuxtla Gutiérrez Centro",418,29000,-93.10933470726,16.752933054982,"Calle 8a. Oriente Norte, TUXTLA GUTIERREZ CENTRO, TUXTLA GUTIERREZ, CHIAPAS, 29000"
8ADF1C0B-C3AD-4529-B986-17BA59CB5013,C7BD7931-8A6E-42BC-9EF2-4D249029E076,"Violencia familiar",1,Doloso,1,2023-07-11,21:40:00,8,1,5.1,Chiapas,7,"San Cristóbal de las Casas",78,"San Cristóbal de las Casas",70780001,"María Auxiliadora",110,29290,-92.633269429207,16.705587032904,"Prolongación Insurgentes, San Cristóbal de las Casas, Chiapas, 29200, México"
494FBA5A-AD23-4FEA-BA48-B4F9F7D69D6D,C901C6A8-4232-4779-90E0-16340D548A5B,"Desobediencia y resistencia de particulares",1,Doloso,2,2025-05-07,03:31:00,6,1,7.11.1,Chiapas,7,"Tuxtla Gutiérrez",101,"Tuxtla Gutiérrez",71010001,"Real del Bosque",349,29040,-93.223146444001,16.712216069475,"Tuxtla Gutiérrez, REAL DEL BOSQUE, TUXTLA GUTIERREZ, CHIAPAS, 29040"
E94F1830-55FE-4F15-AB60-C55B60A9A838,C9196AED-F7DE-4088-ACC1-3C91AA64AB4C,Lesiones,1,Culposo,1,2025-05-26,10:39:00,6,1,1.2.2,Chiapas,7,"San Cristóbal de las Casas",78,"San Cristóbal de las Casas",70780001,"La Raza",88,29264,-92.662982940674,16.72361345126,"Calle de Pípila, LA RAZA, SAN CRISTOBAL DE LAS CASAS, CHIAPAS, 29264"
4E1EFDD4-59EF-4208-AE78-23E19394D5D8,C99D8828-F235-418F-8E9E-3778730CF6F4,"Ataques a las vías de comunicación",1,Culposo,1,2025-05-05,01:29:00,8,1,7.10,Chiapas,7,"Tuxtla Gutiérrez",101,"Tuxtla Gutiérrez",71010001,"Tuxtla Gutiérrez Centro",418,29000,-93.107967609219,16.754384016262,"Copoya, TUXTLA GUTIERREZ CENTRO, TUXTLA GUTIERREZ, CHIAPAS, 29000"
218A13E4-CE71-4C09-BDAE-242A0C0A7CAD,C9AC62B0-F8CA-4B75-9ADA-FEDF1CCD7B27,Discriminación,1,Doloso,1,2025-05-09,14:29:00,8,1,6.3,Chiapas,7,Tonalá,97,"La Victoria",70970619,"La Victoria",35,30500,-93.778352737427,16.079803172772,"Carretera Tonalá - Paredón, LA VICTORIA, TONALA, CHIAPAS, 30500"
E880E22F-DFDB-4A08-BD00-6205F3017DCB,C9FBA368-8CE5-4E98-93EB-98B9A3DB265C,Lesiones,0,Doloso,1,2024-11-06,10:55:00,6,1,1.2.1,Chiapas,7,Yajalón,109,Yajalón,71090001,"Barrio Chul-Ha",7,29930,-92.330442667007,17.173561854785,"Avenida Cuarta Norte Oriente, BARRIO CHULHA, YAJALON, CHIAPAS, 29930"
20B046EF-52F2-43E8-99AD-FB5BE1EFFEED,CA1FB0FF-479B-450B-AF33-C52602AF2611,"Abuso de confianza",1,Doloso,2,2024-09-25,21:00:00,8,1,4.3,Chiapas,7,Tapachula,89,"Tapachula de Córdova y Ordóñez",70890001,Burocrática,47,30700,-92.261887400504,14.904170777785,"Tapachula BUROCRATICA TAPACHULA CHIAPAS 30700"
E053368F-8D8D-4DA6-86F3-2EB7B7546211,CA64B528-6A08-4AEB-8FE4-1C9BF2158735,"Violencia familiar",1,Doloso,1,2025-05-19,02:47:00,2,1,5.1,Chiapas,7,"San Cristóbal de las Casas",78,"San Cristóbal de las Casas",70780001,"Anexo Morelos",232,29300,-92.639150747835,16.733853115728,"NO REFIERE 06, 00"
E2783286-4387-4464-8374-36823EF39C36,CA89886B-EB8A-420D-8B4C-DEFAD99C550F,Pederastia,1,Doloso,1,2025-05-08,18:17:00,3,1,3.7,Chiapas,7,"Tuxtla Gutiérrez",101,"Tuxtla Gutiérrez",71010001,"Las Flores",227,29044,-93.089722394943,16.773936000649,"Avenida Orquídea, LAS FLORES, TUXTLA GUTIERREZ, CHIAPAS, 29044"
36BA42AD-B000-4834-B8E6-473505C64ABB,CAA81F94-96F9-4C2F-99B5-1A81D9B69375,"Desobediencia y resistencia de particulares",1,Doloso,2,2025-05-04,16:35:00,6,1,7.11.1,Chiapas,7,"Tuxtla Gutiérrez",101,"Tuxtla Gutiérrez",71010001,"Paseo del Bosque",324,29094,-93.089504704482,16.763721821091,"Copoya PASEO DEL BOSQUE TUXTLA GUTIERREZ CHIAPAS 29094"
914823EF-71DC-48CB-8B15-8543D43AE87C,CB184192-4E9C-4D43-A5C0-9E243534C713,"Desobediencia y resistencia de particulares",1,Doloso,1,2025-05-06,23:42:00,6,1,7.11.1,Chiapas,7,Suchiate,87,Suchiate,70870184,Suchiate,107,30843,-92.152316518859,14.688343812047,"Avenida Central Norte, SUCHIATE, SUCHIATE, CHIAPAS, 30843"
00ED1F13-C277-4530-8774-EA99B898E948,CB2D2E94-285F-4843-BC18-F97E953E5880,"Robo de Vehículo",1,Doloso,1,2025-05-03,18:30:00,2,1,4.1.14,Chiapas,7,"Comitán de Domínguez",19,"Comitán de Domínguez",70190001,"Otra colonia",-10,0,-92.155648469925,16.244576963157,"Avenida Fontaneros, OTRA COLONIA, COMITAN DE DOMINGUEZ, CHIAPAS, 00000"
E59B7706-F39E-46CF-AD91-EF060D8F187A,CB3ECC54-1C62-43B5-8E10-6A2AFFD5B66B,Lesiones,1,Doloso,1,2025-03-14,17:00:00,6,1,1.2.1,Chiapas,7,Jitotol,47,Jitotol,70470001,"El Carmen Zacatal",4,29760,-92.86039352417,17.066595099125,"Unión Zaragoza, EL CARMEN ZACATAL, JITOTOL, CHIAPAS, 29760"
D9232FB0-413E-4A8E-A328-E758BFFB4A34,CB6C2B0F-2E5E-43F4-9276-08F3A353A38D,"Violencia familiar",1,Doloso,1,2025-03-15,11:25:00,6,1,5.1,Chiapas,7,Cintalapa,17,"Cintalapa de Figueroa",70170001,"Villa Morelos",56,30420,-93.931374429084,16.476084030841,"Villamorelos, VILLA MORELOS, CINTALAPA, CHIAPAS, 30420"
B3BBBF18-A711-4661-A889-3FA3722E7123,CB716F90-793F-4AFD-860C-9995852435A2,Lesiones,0,Doloso,1,2025-05-11,18:05:00,6,1,1.2.1,Chiapas,7,"Tuxtla Gutiérrez",101,"Sacramento de Jesús",71010416,"Sacramento De Jesús",463,29000,-93.052825927734,16.728949899895,"Tuxtla Gutiérrez, SACRAMENTO DE JESUS, TUXTLA GUTIERREZ, CHIAPAS, 29000"
D91C1E48-44CA-4F9B-BB0D-5DA2C765A951,CC11CDB3-09F3-483D-99B9-4FAD0BC5CFB6,Lesiones,1,Culposo,1,2025-05-29,17:06:00,6,2,1.2.2,Chiapas,7,"Tuxtla Gutiérrez",101,"Tuxtla Gutiérrez",71010001,"17 de Mayo",5,29019,-93.093446494069,16.78720680427,"Avenida Benito Juárez, 17 DE MAYO, TUXTLA GUTIERREZ, CHIAPAS, 29019"
0D8E51E1-128D-4417-B12C-618921643A1E,CC473639-2E64-4296-87A6-F97FE23FA990,Homicidio,1,Culposo,1,2025-05-06,14:01:00,4,1,1.1.2,Chiapas,7,"Villa Corzo",107,Monterrey,71070574,Monterrey,58,30520,-93.272833390074,16.182467693638,"Villa Corzo, MONTERREY, VILLA CORZO, CHIAPAS, 30520"
D4D4A7C7-2B74-40B0-AB9D-7EAF2FBD259B,CCD30DEC-653C-449F-A1CC-34814F3958AE,Homicidio,1,Doloso,1,2025-05-02,19:25:00,1,1,1.1.1,Chiapas,7,Tuzantán,103,Tuzantán,71030001,"3er. Cantón",18,30680,-92.444000244577,15.131640641691,"Xochiltepec, 3ER CANTON, TUZANTAN, CHIAPAS, 30680"
508EC999-166D-4742-8BD1-3D2A00278379,CCEE2A68-5C9E-462D-9F08-D3104646AF54,Homicidio,1,Doloso,1,2025-05-18,18:37:00,1,1,1.1.1,Chiapas,7,"Tuxtla Gutiérrez",101,"Tuxtla Gutiérrez",71010001,"Nueva Jerusalen",461,29020,-93.207192420959,16.786032411916,"Tuxtla Gutiérrez, NUEVA JERUSALEN, TUXTLA GUTIERREZ, CHIAPAS, 29020"
FB020A07-C4CD-45F5-8252-554FBCEB281A,CCEF2D4A-3392-4023-B653-3BCF04C03051,"Robo de Vehículo",1,Doloso,1,2025-05-13,09:23:00,1,1,4.1.2.2,Chiapas,7,Mapastepec,51,Mapastepec,70510001,"Otra colonia",-10,30560,-92.902282606786,15.439456341129,"Mapastepec, OTRA COLONIA, MAPASTEPEC, CHIAPAS, 30560"
FADAE98F-2723-43D7-9C9F-C536851A6C8A,CD862FFA-7BB8-4EAE-B348-8E02417CB7CC,Daños,0,Culposo,1,2025-05-25,11:53:00,8,1,4.5,Chiapas,7,"Tuxtla Gutiérrez",101,"Tuxtla Gutiérrez",71010001,Coquelequixtlán,109,29090,-93.097565174103,16.751059903636,"Boulevard Ángel Albino Corzo, COQUELEQUIXTLAN, TUXTLA GUTIERREZ, CHIAPAS, 29090"
5A164412-DC95-4652-B0A5-D9296C53BDE2,CDA150E8-9F50-409D-BC84-6646D9EFB717,"Violencia familiar",1,Doloso,1,2024-08-15,13:46:00,6,1,5.1,Chiapas,7,"Tuxtla Gutiérrez",101,"Tuxtla Gutiérrez",71010001,"Santa Ana",397,29090,-93.099437355995,16.737994846737,"AVENIDA FRANCISCO J. GRAJALES "
A108C1BE-B883-43FD-9002-7677B3B67810,CE2BCCAE-C9B1-4582-A5AC-DD7390D32AA6,Homicidio,1,Culposo,1,2025-05-16,06:16:00,6,1,1.1.2,Chiapas,7,"Tuxtla Gutiérrez",101,"Tuxtla Gutiérrez",71010001,"13 de Julio",2,29045,-93.130810275958,16.756127203372,"8a NORTE ESQUINA 6A PONIENTE NUMERO 906 COLONIA COLON 13 DE JULIO TUXTLA GUTIERREZ CHIAPAS 29045"
28B83AC5-BFC7-41B3-B834-F7AB617E21AB,CEBE0352-4BB0-4E61-903C-03D8E45EECD8,"Robo a Negocio",0,Doloso,1,2025-05-13,14:43:00,8,1,4.1.11,Chiapas,7,"Tuxtla Gutiérrez",101,"Tuxtla Gutiérrez",71010001,"San Roque",395,29080,-93.116855621338,16.754048846634,"Copoya, SAN ROQUE, TUXTLA GUTIERREZ, CHIAPAS, 29080"
50BB15E5-D500-4835-8716-17CF2162BF0F,CF2A342D-89E2-4F28-9F3C-7189F23FE6A0,Daños,1,Culposo,1,2025-05-12,22:13:00,8,1,4.5,Chiapas,7,Tapachula,89,"Tapachula de Córdova y Ordóñez",70890001,"Tapachula Centro",325,30700,-92.268515653706,14.894125209409,"Framboyanes, TAPACHULA CENTRO, TAPACHULA, CHIAPAS, 30700"
B1171C72-D470-4A8A-AE88-641505131EF3,CF70498F-E0A1-4638-A2F2-1035608ECB5A,Pederastia,1,Doloso,2,2025-05-18,13:55:00,3,1,3.7,Chiapas,7,"Comitán de Domínguez",19,"Laguna Larga",70190070,"Laguna Larga",79,30100,-92.260694503784,16.420787874714,"Laguna Larga LAGUNA LARGA COMITAN DE DOMINGUEZ CHIAPAS 30100"
1485C82A-7D98-4B3F-984C-B5FDEEE8DE30,CFAEF39E-0BD9-4978-894B-6310DFF0B387,Homicidio,1,Culposo,1,2025-05-01,14:00:00,6,1,1.1.2,Chiapas,7,Chenalhó,26,Chenalhó,70260001,"Santa Martha",26,29875,-92.667660713196,16.898670265439,"Chenalhó, SANTA MARTHA, CHENALHO, CHIAPAS, 29875"
CB6FFFE5-4E4F-49EC-B46F-CF4ABED9F9B5,CFC3900D-582C-447D-8AC7-BBBEFC97F933,"Violencia familiar",1,Doloso,1,2025-04-28,11:34:00,8,1,5.1,Chiapas,7,Palenque,65,Palenque,70650001,"Otra colonia",-10,29960,-91.984405517578,17.493424294743,"Palenque, OTRA COLONIA, PALENQUE, CHIAPAS, 29960"
60D8331A-5C68-4EE0-AC99-F8532493E240,CFE02116-09EC-44EC-AC9A-6D32426CF0C4,"Ataques a las vías de comunicación",1,Culposo,1,2025-05-03,03:00:00,8,1,7.10,Chiapas,7,"Tuxtla Gutiérrez",101,"Tuxtla Gutiérrez",71010001,"7 de Octubre",19,29096,-93.13093807776,16.761502630761,"8a. NORTE ESQUINA 6A. PONIENTE, NUMERO 906, COLONIA COLON, 7 DE OCTUBRE, TUXTLA GUTIERREZ, CHIAPAS, 29096"
207F0017-0F99-43A7-BE40-57EA518C5945,CFE7D6AE-AF65-4637-972C-456380B476E2,"Robo de Vehículo",1,Doloso,1,2025-05-15,21:00:00,1,1,4.1.2.1,Chiapas,7,Palenque,65,Palenque,70650001,Chancala,83,29960,-91.654701075693,17.292727108184,"CHANCALA PALENQUE CHIAPAS 29960"
6D9773C9-8576-49D5-B42E-9CD1241EC4F9,CFECC4F9-7352-404B-B1D6-141A0171C10F,"Ataques a las vías de comunicación",1,Culposo,1,2025-05-11,04:25:00,8,1,7.10,Chiapas,7,Reforma,74,Reforma,70740001,"Ranchería Vicente Guerrero",98,29500,-93.144364356995,17.885512382615,"Carretera Paso de Cunduacán-Estación Juárez, RANCHERIA VICENTE GUERRERO, REFORMA, CHIAPAS, 29500"
37026F88-CA19-4E17-B884-4F159A1F7ABD,CFF9CF73-08F2-47C3-A070-93392C979757,Discriminación,1,Doloso,2,2025-04-13,10:09:00,8,1,6.3,Chiapas,7,Tonalá,97,"Las Flores",70970980,"Las Flores",37,30500,-93.748129606247,16.088783314975,"Avenida Hidalgo, LAS FLORES, TONALA, CHIAPAS, 30500"
BF850ED5-89D9-43DB-8F27-4FD8DB1E865C,D0386542-B8EC-4623-AD3C-CA8D290AB131,Amenazas,0,Doloso,1,2025-05-08,16:21:00,6,1,7.2,Chiapas,7,"Tuxtla Gutiérrez",101,"Tuxtla Gutiérrez",71010001,"Cruz Con Casita",111,29019,-93.119893312721,16.749920605393,"Copoya, CRUZ CON CASITA, TUXTLA GUTIERREZ, CHIAPAS, 29019"
F01FFB20-0590-4AFE-9B81-755989FA8555,D0B3CDB1-F87A-4F99-B115-B7D3FB7C177D,"Robo de Vehículo",1,Doloso,1,2025-05-05,13:18:00,2,1,4.1.2.2,Chiapas,7,Tuzantán,103,Tuzantán,71030001,Tuzantan,9,30680,-92.420606431511,15.147148311703,"Tuzantán, TUZANTAN, TUZANTAN, CHIAPAS, 30680"
B94B5D5D-BF3E-4E43-9E01-254E97FA6F9E,D1770287-9332-4921-9409-BCDE32C270CB,Homicidio,1,Culposo,1,2025-05-08,02:59:00,6,1,1.1.2,Chiapas,7,Tila,96,Tila,70960001,"Otra colonia",-10,29910,-92.425746917725,17.300129670986,"Tila, OTRA COLONIA, TILA, CHIAPAS, 29910"
F7AD7625-E1AA-4680-884D-0CF555D015AE,D26F9A5B-D955-423C-92F7-F806DF4BEB48,Extorsión,1,Doloso,1,2025-05-05,11:54:00,8,1,4.4.2,Chiapas,7,Tonalá,97,Tonalá,70970001,Tonatlán,66,30500,-93.755950927734,16.088006139826,"Tonalá, TONATLAN, TONALA, CHIAPAS, 30500"
5B3870BE-52DB-4E52-9701-D41B09E81DF0,D2804F30-8A45-4EF2-B147-DFE2B305AE28,"Desobediencia y resistencia de particulares",1,Doloso,1,2025-05-08,14:21:00,6,1,7.11.1,Chiapas,7,Tapachula,89,"Tapachula de Córdova y Ordóñez",70890001,Democracia,70,30767,-92.274298667908,14.909362864539,"Vista Hermosa, DEMOCRACIA, TAPACHULA, CHIAPAS, 30767"
42FF5D25-23C8-4DE2-84B8-5553845FC00B,D33BB9F3-0226-4305-9BE0-D0DE792F6AA8,Extorsión,1,Doloso,1,2025-05-04,20:59:00,8,1,4.4.1,Chiapas,7,"Comitán de Domínguez",19,"Comitán de Domínguez",70190001,"7 Esquinas",4,30015,-92.130725383759,16.259131033157,"Calle 8a Oriente Norte, 7 ESQUINAS, COMITAN DE DOMINGUEZ, CHIAPAS, 30015"
213DE18A-295C-48E2-AEC9-119AB90D50AF,D393C993-AA96-4A97-B01A-F3807908EABA,"Desobediencia y resistencia de particulares",1,Doloso,2,2025-05-24,13:09:00,6,1,7.11.1,Chiapas,7,Motozintla,57,"Motozintla de Mendoza",70570001,"22 de Octubre",2,30900,-92.247905731201,15.365358025147,"Motozintla de Mendoza, 22 DE OCTUBRE, MOTOZINTLA, CHIAPAS, 30900"
7DC6001E-3CC4-4264-8EDE-15F13C86B2E9,D44B37AF-EAFF-4D53-A9E5-64A6D54C7CBF,"Violencia familiar",1,Doloso,1,2025-05-06,14:40:00,8,1,5.1,Chiapas,7,"Tuxtla Gutiérrez",101,"Tuxtla Gutiérrez",71010001,"Los Poetas",491,29045,-93.062165379524,16.755265117896,"Edif. C, LOS POETAS, TUXTLA GUTIERREZ, CHIAPAS, 29045"
8A7928A8-1DAE-4713-A0A7-7410E72A4CF5,D4B64F7B-F0F7-430A-A1D9-6407A4F80E73,"Desobediencia y resistencia de particulares",1,Doloso,1,2025-05-13,18:25:00,6,1,7.11.1,Chiapas,7,Tapachula,89,"Tapachula de Córdova y Ordóñez",70890001,"Tapachula Centro",325,30700,-92.270643984266,14.899355700676,"Las Palmas, TAPACHULA CENTRO, TAPACHULA, CHIAPAS, 30700"
865AFA32-BD6B-4C8B-8D5F-91F2B768CBE5,D4B94B82-D689-4AAE-96AC-FAEBFDC9429D,Lesiones,0,Culposo,1,2025-05-27,01:08:00,4,1,1.2.2,Chiapas,7,"San Cristóbal de las Casas",78,"San Cristóbal de las Casas",70780001,"Maestros de México",109,29246,-92.637040615082,16.720236703105,"Prolongación le los Insurgentes, MAESTROS DE MEXICO, SAN CRISTOBAL DE LAS CASAS, CHIAPAS, 29246"
0F39F8FC-0542-44E1-A876-70571020886F,D54FBBAB-DCB8-40F5-B83B-875AA2B5F3C6,"Ataques a las vías de comunicación",1,Culposo,1,2025-05-09,02:31:00,8,1,7.10,Chiapas,7,"Tuxtla Gutiérrez",101,"Las Arboledas",71010432,"Las Arboledas",221,29030,-93.134724497795,16.754436105551,"Boulevard Doctor Belisario Domínguez, LAS ARBOLEDAS, TUXTLA GUTIERREZ, CHIAPAS, 29030"
CCEFAE07-C3C8-4356-85F1-82685F1B1121,D5863ED5-CCB8-4E6F-8FBC-090E7266F446,"Robo a Casa Habitación",0,Doloso,1,2025-05-09,18:00:00,1,1,4.1.1,Chiapas,7,Huehuetán,37,Huehuetán,70370001,"San José",46,30673,-92.432270050049,14.985213378032,"Huehuetán Estación FFCC, SAN JOSE, HUEHUETAN, CHIAPAS, 30673"
B4D48A8B-F26F-4E55-9D72-C268F4F20D88,D5C74299-3007-44E7-BBA5-EDC979A7F0E5,"Contra la salud (Narcomenudeo)",1,Doloso,2,2025-05-13,20:51:00,8,1,7.1.1,Chiapas,7,Tila,96,"El Limar",70960040,"El Limar",7,29910,-92.404097960099,17.416099693291,"El Limar, EL LIMAR, TILA, CHIAPAS, 29910"
E2E1A946-D151-4B8D-BACD-EC32FF128819,D5CA164B-196E-42CF-BE39-19923A8CA6A4,Extorsión,1,Doloso,1,2025-04-29,09:14:00,6,1,4.4.2,Chiapas,7,Villaflores,108,Villaflores,71080001,"Villaflores Centro",78,30475,-93.276329040527,16.232403646793,"Villaflores, VILLAFLORES CENTRO, VILLAFLORES, CHIAPAS, 30475"
75043163-B26D-4EAE-9683-7C4FBFC1436E,D63A540E-6728-4365-B392-97F30A7E2D7E,Daños,1,Culposo,1,2025-05-08,20:48:00,8,1,4.5,Chiapas,7,Mazatán,54,Mazatán,70540001,Mazatán,12,30650,-92.449471056461,14.863087848323,"Calle Matías de Córdova Poniente, MAZATAN, MAZATAN, CHIAPAS, 30650"
4940C5CF-AE2B-4180-95E0-0BB5046FEC6D,D645840B-4732-410B-B12E-5876A2E932E9,"Violencia familiar",1,Doloso,1,2025-05-09,09:52:00,2,1,5.1,Chiapas,7,Huitiupán,39,"El Desengaño",70390194,"El Desengaño",16,29710,-92.68238067627,17.176475212719,"Huitiupan EL DESENGANO HUITIUPAN CHIAPAS 29710"
ECB2C108-5002-4A90-A42A-76DB872890BE,D6E1AA1C-1BD5-4AF5-B32D-1A581A0F0EDF,Homicidio,1,Culposo,1,2025-05-31,08:30:00,4,1,1.1.2,Chiapas,7,Ocosingo,59,Ocosingo,70590001,"Otra colonia",-10,29940,-92.098388671875,16.906283827728,"Los Pinos, OTRA COLONIA, OCOSINGO, CHIAPAS, 29940"
56A4A225-9937-4783-AECD-E4D1B07128EE,D7B56AF9-C413-4C0C-8007-52FF9ABF9D76,"Robo Otros",1,Doloso,1,2025-04-25,20:00:00,1,1,4.1.14,Chiapas,7,Simojovel,81,"Simojovel de Allende",70810001,"Mercedes la Esperanza",66,29834,-92.707271575928,17.140590473397,"Simojovel de Allende, MERCEDES LA ESPERANZA, SIMOJOVEL, CHIAPAS, 29834"
86FC021A-609D-4818-A90E-961123D75A5C,D7F2A3BC-268B-40A7-8CCD-B6BEDE5CD6DC,"Contra la salud (Narcomenudeo)",1,Doloso,2,2025-05-04,18:35:00,8,1,7.1.1,Chiapas,7,Palenque,65,Palenque,70650001,"Palenque Centro",67,29960,-91.991271972656,17.508450309809,"Palenque, PALENQUE CENTRO, PALENQUE, CHIAPAS, 29960"
DAE218D3-CAA1-4664-92CF-A807E0EAE776,D7FC4EFB-139B-4243-A3E5-9913EB56CA55,Extorsión,1,Doloso,1,2025-05-19,10:47:00,8,1,4.4.1,Chiapas,7,Villaflores,108,Villaflores,71080001,Solidaridad,72,30479,-93.268947601318,16.234747141971,"Villaflores, SOLIDARIDAD, VILLAFLORES, CHIAPAS, 30479"
7373BA23-A66A-4EA8-ABAC-D825DF435085,D824179D-0D35-4669-BA36-B649D8C6FF76,"Robo de Vehículo",1,Doloso,1,2025-05-11,17:00:00,6,1,4.1.2.1,Chiapas,7,Socoltenango,83,"Nuevo Tamaulipas",70830050,"Nuevo Tamaulipas",41,30397,-92.374898713859,16.207752340025,"Socoltenango NUEVO TAMAULIPAS SOCOLTENANGO CHIAPAS 30397"
F4CB432F-8080-4207-9CA1-9936B54176D7,D829EEB7-D3C1-43CE-94F7-46C6BAB669A2,"Contra la salud (Narcomenudeo)",1,Doloso,2,2025-05-04,16:50:00,8,1,7.1.2,Chiapas,7,Tonalá,97,Paredón,70970040,Paredón,46,30503,-93.871972560882,16.053129512765,"Paredón, PAREDON, TONALA, CHIAPAS, 30503"
BF1E8585-7DF4-449E-BF2C-9089E256BFC7,D881BB9A-7AC1-4680-9457-8CCE30CA1D0F,Pederastia,1,Doloso,2,2025-05-06,16:00:00,3,1,3.7,Chiapas,7,Jitotol,47,"Las Maravillas",70470043,"Las Maravillas",9,29767,-92.860565185547,17.066923303128,"Unión Zaragoza, LAS MARAVILLAS, JITOTOL, CHIAPAS, 29767"
FA0F47BC-E820-4AD1-9F44-E205B8C028BB,D8B85D6B-A613-4F08-BE4E-637763753884,Daños,1,Doloso,1,2025-05-04,00:44:00,8,1,4.5,Chiapas,7,"San Cristóbal de las Casas",78,"San Cristóbal de las Casas",70780001,"San Diego",146,29270,-92.635704874992,16.727096661065,"Calle Venustiano Carranza, SAN DIEGO, SAN CRISTOBAL DE LAS CASAS, CHIAPAS, 29270"
13440185-DFCB-45DD-8CFA-400ED4499FB7,D8E7C745-F099-41D3-8F9E-C57AE20CCF4D,"Acoso Sexual",0,Doloso,1,2025-04-29,16:38:00,8,1,3.2,Chiapas,7,Palenque,65,Palenque,70650001,"Palenque Centro",67,29960,-91.986637115479,17.497517305866,"Palenque, PALENQUE CENTRO, PALENQUE, CHIAPAS, 29960"
3A8A43F2-D1F8-473C-A362-B6AA3DA65286,D8FB01EE-4629-47F9-B9F3-FE7254967A56,Homicidio,1,Doloso,1,2025-04-07,23:26:00,6,1,1.1.1,Chiapas,7,Tumbalá,100,Tumbalá,71000001,Cuetiepa,3,29921,-92.319154886759,17.281123220874,"Tumbalá, CUETIEPA, TUMBALA, CHIAPAS, 29921"
BE7A1932-73D5-4023-9B33-582973234108,D90E77AD-A794-44D7-9C15-FEAC3757BF73,"Ataques a las vías de comunicación",1,Culposo,1,2025-05-12,05:26:00,8,1,7.10,Chiapas,7,Tapachula,89,"Tapachula de Córdova y Ordóñez",70890001,"Otra colonia",-10,30700,-92.260780334473,14.903778522224,"Framboyanes, OTRA COLONIA, TAPACHULA, CHIAPAS, 30700"
5F4A3F76-C509-4125-A6B0-7BE555E4EF53,D921712E-D08F-4679-A844-E54090B05F77,Daños,1,Doloso,1,2023-04-19,17:08:00,8,1,4.5,Chiapas,7,"San Cristóbal de las Casas",78,"El Pinar",70780050,"El Pinar",197,29233,-92.624015808105,16.6617764624,"San Cristóbal de las Casas, Chiapas, 29200, México"
51F809B0-57DD-4935-BF0B-3D956E28D7AC,D9256823-176D-423F-9061-D0484922A8EE,Pederastia,1,Doloso,2,2025-05-29,19:09:00,3,1,3.7,Chiapas,7,Villaflores,108,Villaflores,71080001,"Matías Castellanos",51,30476,-93.275599479675,16.247551532389,"Santa Catarina, MATIAS CASTELLANOS, VILLAFLORES, CHIAPAS, 30476"
6285F5F0-26DD-4378-BA7E-336C6482CA81,D943F23E-8441-449F-9F68-2C3528FFE086,"Violación Equiparada",1,Doloso,1,2025-05-04,19:02:00,6,1,3.8.2,Chiapas,7,Chilón,31,Chilón,70310001,"Barrio San Antonio Pathuitz",66,29940,-92.273998260498,17.104170704563,"Chilón, BARRIO SAN ANTONIO PATHUITZ, CHILON, CHIAPAS, 29940"
85B81992-0DBC-49E2-96BB-3B272DDAC56C,D980BF8A-E5AD-458F-8879-874862515F87,"Contra la salud (Narcomenudeo)",1,Doloso,2,2025-05-04,15:55:00,8,1,7.1.2,Chiapas,7,Tonalá,97,Paredón,70970040,Paredón,46,30503,-93.753794431686,16.088957434006,"Calle 16 de Septiembre, PAREDON, TONALA, CHIAPAS, 30503"
E39C2500-CE23-4F0A-A0BE-C50878E64B98,D9861044-76C8-4C3B-987D-AC34FC0D0737,"Robo Otros",1,Doloso,2,2024-09-20,13:14:00,8,1,4.1.14,Chiapas,7,"Tuxtla Gutiérrez",101,"Tuxtla Gutiérrez",71010001,"Tuxtla Gutiérrez Centro",418,29000,-93.117027282715,16.752240718304,"Copoya, Tuxtla Gutiérrez, Chiapas, 29066, México S/N, S/N"
