ID_CI,ID_DELITO,DTO,DTO_PRIN,MODA_DTO,FORMA_ACC,FHA_DE_HCHOS,HRA_DE_HCHOS,EMTO_COM_DTO,GRDO_CONS,CLASF_DE_DTO,NOM_ENT_HCHOS,ID_ENT_HCHOS,NOM_MUN_HCHOS,ID_MUN_HCHOS,NOM_LOC_HCHOS,ID_LOC_HCHOS,NOM_COL_HCHOS,ID_COL_HCHOS,CP,COORD_X,COORD_Y,DOM_HCHOS
ACCD651C-A50C-4D5B-ABC1-23BEB7FB344C,2F246A48-1909-4205-A09F-EC5F9644B8A1,"Falsificación de documentos en general",1,Doloso,2,2025-05-08,16:25:00,8,1,7.6,Chiapas,7,"San Cristóbal de las Casas",78,"San Cristóbal de las Casas",70780001,"Anexo Morelos",232,29300,-92.638635724759,16.735515291738,"NO REFIERE 06, 00"
FA0F47BC-E820-4AD1-9F44-E205B8C028BB,2F3C7D74-517E-43FD-A1CC-B74B41101169,"Ataques a las vías de comunicación",0,Doloso,1,2025-05-04,00:44:00,8,1,7.10,Chiapas,7,"San Cristóbal de las Casas",78,"San Cristóbal de las Casas",70780001,"San Diego",146,29270,-92.635704874992,16.727096661065,"Calle Venustiano Carranza, SAN DIEGO, SAN CRISTOBAL DE LAS CASAS, CHIAPAS, 29270"
68F894A0-679E-4D64-811E-DA4E6F24D270,2F628079-BAD7-4B04-AAC9-64A069282026,"Contra la salud (Narcomenudeo)",1,Doloso,2,2025-05-04,14:43:00,8,1,7.1.2,Chiapas,7,"Tuxtla Gutiérrez",101,"Tuxtla Gutiérrez",71010001,"Plan de Ayala",333,29110,-93.158912658691,16.675626071604,"Copoya, PLAN DE AYALA, TUXTLA GUTIERREZ, CHIAPAS, 29110"
FBEF0B81-C4FB-40CE-9880-14C6866EACFD,3015B25C-ED96-4463-BCC3-C2635BB02E35,Daños,0,Culposo,1,2025-05-05,21:45:00,8,1,4.5,Chiapas,7,"Chiapa de Corzo",27,"Chiapa de Corzo",70270001,"Benito Juárez",6,29160,-92.993001937866,16.71279729083,"BENITO JUAREZ CHIAPA DE CORZO CHIAPAS 29160"
E38BF86A-B2A4-4E98-8D24-0FD1F390A239,3079CB99-3ED3-4948-9F57-7B6900CEAD34,"Robo Otros",1,Doloso,1,2025-05-03,20:00:00,1,1,4.1.14,Chiapas,7,Simojovel,81,"Simojovel de Allende",70810001,"Otra colonia",-10,29820,-92.710189819336,17.139442211232,"Simojovel de Allende, OTRA COLONIA, SIMOJOVEL, CHIAPAS, 29820"
0F33AE10-1DA7-4274-96C1-71D1EFEAD29D,308B2C48-3C0B-48C1-83AD-F773A1139CD0,"Robo de Vehículo",1,Doloso,2,2025-05-02,20:02:00,6,1,4.1.2.1,Chiapas,7,"San Cristóbal de las Casas",78,"San Cristóbal de las Casas",70780001,"San Ramón",161,29240,-92.652515408067,16.736537731994,"Calle Sonora, SAN RAMON, SAN CRISTOBAL DE LAS CASAS, CHIAPAS, 29240"
769B6F22-7048-4BBB-B7B4-5B6471CC4F62,30AADCF5-24DA-467B-9F37-5714405759E5,Pederastia,1,Doloso,1,2025-01-06,14:55:00,3,1,3.7,Chiapas,7,"San Cristóbal de las Casas",78,"San Cristóbal de las Casas",70780001,"11 Cuartos",2,29220,-92.639808654785,16.736131180679,"NINGUNA 02, 01"
028042FE-10BA-4262-8AA7-95ABD88D3544,30DB153D-496E-4BE3-BC34-01991D308110,"Fraude   ",1,Doloso,2,2025-01-27,12:26:00,6,1,4.2,Chiapas,7,Copainalá,21,Copainalá,70210001,Concepción,12,29620,-93.211140632629,17.092097136866,"Copainalá, CONCEPCION, COPAINALA, CHIAPAS, 29620"
B483799E-5277-429C-BCD5-F1041EC775D3,30E7AFAE-B9CA-4727-BF06-7C18F7B3AA87,Violación,1,Doloso,1,2025-05-15,17:28:00,3,1,3.8.1,Chiapas,7,Pantelhó,66,Pantelhó,70660001,Pantelho,3,29880,-92.472438812256,17.005046659622,"Emiliano Zapata Segundo, PANTELHO, PANTELHO, CHIAPAS, 29880"
7E13CAED-DA3D-4205-875E-D7512E50C547,31124398-A1D4-47D9-ABD1-B56D0584EF14,Homicidio,1,Culposo,1,2025-05-18,12:40:00,4,1,1.1.2,Chiapas,7,Catazajá,16,Catazajá,70160001,Catazaja,3,29980,-91.965351104736,17.728231254968,"Emilliano Zapata (San Joaquín), CATAZAJA, CATAZAJA, CHIAPAS, 29980"
16135012-8F01-4359-ACF5-B7A342946562,314E9DCC-B97B-4270-AD4F-DC5090646E2C,Homicidio,1,Culposo,1,2025-05-07,21:14:00,4,1,1.1.2,Chiapas,7,Chicomuselo,30,Chicomuselo,70300001,Chicomuselo,1,30120,-92.284987270832,15.753075281141,"Chicomuselo, CHICOMUSELO, CHICOMUSELO, CHIAPAS, 30120"
C34F6938-7F13-489C-AB55-D7DA0E251BC8,31648FD0-3191-4208-88F4-109AFDC84977,"Robo de Vehículo",1,Doloso,1,2025-05-08,14:59:00,1,1,4.1.2.1,Chiapas,7,Tila,96,Tila,70960001,Tila,17,29910,-92.428559286778,17.300772165307,"Tila, TILA, TILA, CHIAPAS, 29910"
411D7AC2-A955-40C6-8280-71FF073F8BE1,3192C2E7-FF89-4B18-AB5A-9FD2DD98BABE,Lesiones,1,Culposo,1,2025-05-22,23:15:00,4,1,1.2.2,Chiapas,7,Tapachula,89,"Santa Clara",70890553,"Santa Clara",313,30788,-92.265186470814,14.906448242127,"Tapachula, SANTA CLARA, TAPACHULA, CHIAPAS, 30788"
65A32EC6-1088-404E-8A0D-B5EB02A22BF9,31950AF2-A851-4333-8638-C9FDCE89124B,Homicidio,1,Doloso,1,2025-05-05,11:30:00,1,1,1.1.1,Chiapas,7,Berriozábal,12,"La Libertad",70120306,"La Libertad",45,29130,-93.212728500366,16.790399109504,"El Sabino, LA LIBERTAD, BERRIOZABAL, CHIAPAS, 29130"
E61989D2-BEA7-48A1-942C-48F4B7E9FF60,319FE7B4-14AD-4A85-8ACB-1D3EBDBF755C,"Robo de Vehículo",1,Doloso,2,2025-05-26,18:43:00,6,1,4.1.14,Chiapas,7,"Chiapa de Corzo",27,"Chiapa de Corzo",70270001,"Otra colonia",-10,29160,-93.018997907638,16.738343047979,"OTRA COLONIA, CHIAPA DE CORZO, CHIAPAS, 29160"
646CE939-5B16-42F4-8913-DA0F41DD5187,324CD2BA-FC85-443C-8DA8-A2D28C9032ED,Homicidio,1,Culposo,1,2025-05-04,14:35:00,4,1,1.1.2,Chiapas,7,Pijijiapan,69,Pijijiapan,70690001,"Pijijiapan Centro",45,30540,-93.209552764893,15.683002763667,"Pijijiapan, PIJIJIAPAN CENTRO, PIJIJIAPAN, CHIAPAS, 30540"
0557641B-A40F-4F18-A197-BF4025EE86A4,329DDC8F-7C4A-4863-922F-7AE82ECCAC13,Homicidio,1,Doloso,1,2025-05-12,09:56:00,6,1,1.1.1,Chiapas,7,"Tuxtla Gutiérrez",101,"Tuxtla Gutiérrez",71010001,Popular,337,29089,-93.093826601429,16.733753336261,"Piedra Santa, POPULAR, TUXTLA GUTIERREZ, CHIAPAS, 29089"
865AFA32-BD6B-4C8B-8D5F-91F2B768CBE5,330B7569-48F0-4369-8FE7-78C97D3B7C87,"Ataques a las vías de comunicación",1,Culposo,1,2025-05-27,01:08:00,8,1,7.10,Chiapas,7,"San Cristóbal de las Casas",78,"San Cristóbal de las Casas",70780001,"Maestros de México",109,29246,-92.637040615082,16.720236703105,"Prolongación le los Insurgentes, MAESTROS DE MEXICO, SAN CRISTOBAL DE LAS CASAS, CHIAPAS, 29246"
52A92AD8-5A01-4B75-8370-0FE156C05726,3322ADCC-43CD-4EE2-8DAF-50143C36DAFD,Extorsión,1,Doloso,2,2025-05-02,15:35:00,8,1,4.4.1,Chiapas,7,Tapachula,89,"Tapachula de Córdova y Ordóñez",70890001,"Otra colonia",-10,30700,-92.261810302734,14.906100921217,"Framboyanes, OTRA COLONIA, TAPACHULA, CHIAPAS, 30700"
3A303DEB-C976-4020-BCF3-02F789A0471C,3338F86E-E03D-484C-A130-F505FC1694CC,"Armas prohibidas",1,Doloso,2,2025-05-03,01:32:00,8,1,7.10,Chiapas,7,Tapachula,89,"Tapachula de Córdova y Ordóñez",70890001,"Ciudad de Tapachula",61,30709,-92.263021169494,14.912262187236,"Framboyanes, CIUDAD DE TAPACHULA, TAPACHULA, CHIAPAS, 30709"
C894E1C4-44FD-40F8-9E48-9ECF47A8ACE8,3340E38F-920B-494F-8F3F-03BB75CFB9C7,Lesiones,1,Culposo,1,2025-05-10,10:15:00,4,1,1.2.2,Chiapas,7,Tapachula,89,"Tapachula de Córdova y Ordóñez",70890001,"Tapachula Centro",325,30700,-92.265796065331,14.917260431031,"San Juan, TAPACHULA CENTRO, TAPACHULA, CHIAPAS, 30700"
666036D9-45DB-4C75-9EFB-73FA872A718B,3341E4EB-D150-4F44-B10D-A4E53212394B,"Robo Otros",1,Doloso,2,2025-05-16,18:29:00,8,1,4.1.14,Chiapas,7,Berriozábal,12,Berriozábal,70120001,Berriozabal,3,29130,-93.273668289184,16.800825622187,"San Miguel, BERRIOZABAL, BERRIOZABAL, CHIAPAS, 29130"
7B6918E7-64E6-4DEB-834D-01722D270265,334C8AA9-ED3E-40E3-93BB-4440E5891017,"Robo a Negocio",1,Doloso,2,2025-05-20,20:18:00,8,1,4.1.11,Chiapas,7,"Comitán de Domínguez",19,"Comitán de Domínguez",70190001,"Chichima Acapetahua",28,30093,-92.114532169829,16.216669195061,"Carretera Internacional a Huixtla, CHICHIMA ACAPETAHUA, COMITAN DE DOMINGUEZ, CHIAPAS, 30093"
6AA8690B-A46E-4FEE-AD28-9369FC78A312,33552245-9736-430B-AC5E-7414507096A0,"Contra la salud (Narcomenudeo)",1,Doloso,2,2025-05-08,22:35:00,8,1,7.1.1,Chiapas,7,Tapachula,89,"Tapachula de Córdova y Ordóñez",70890001,"Pedregal San Ángel",255,30795,-92.253956794739,14.936317038208,"Huertos de Janeiro, PEDREGAL SAN ANGEL, TAPACHULA, CHIAPAS, 30795"
B0D85E15-7E70-445B-81A8-623B96A42E7B,34CA34A7-CE59-47C0-901C-6422373D7C69,"Ataques a las vías de comunicación",1,Culposo,1,2025-05-17,00:11:00,8,1,7.10,Chiapas,7,"San Cristóbal de las Casas",78,"San Cristóbal de las Casas",70780001,"Anexo Morelos",232,29300,-92.638292376042,16.735990199014,"NO REFIERE 06, 00"
88A28A2F-DB61-4399-BBF6-D50B4763A2C5,350B499D-92C6-445D-AE0E-98291853F3DE,Pederastia,1,Doloso,2,2025-04-05,15:04:00,3,1,3.7,Chiapas,7,"San Cristóbal de las Casas",78,"San Cristóbal de las Casas",70780001,"Emiliano Zapata",55,29210,-92.633156776428,16.744500758977,"NINGUNA SIN DATO, 30"
40A01E67-0DF1-4DA1-8AD8-D994598FE74D,3557C748-E1CC-4A56-895A-3E0B12031ED8,"Abuso sexual",1,Doloso,2,2024-07-19,15:59:00,8,1,3.1,Chiapas,7,"San Cristóbal de las Casas",78,"San Cristóbal de las Casas",70780001,"10 de Abril",1,29220,-92.637062072754,16.72886192223,"San Cristóbal, San Cristóbal de las Casas, Chiapas, 29200, México"
C1153654-BC6C-4D53-AA58-FB25BDC046E7,35922687-E9ED-4013-9CF3-D91ACBC880F9,"Violencia familiar",1,Doloso,1,2025-04-21,20:52:00,8,1,5.1,Chiapas,7,Palenque,65,Palenque,70650001,"Nuevo Arroyo",108,29960,-91.984577178955,17.496371272042,"Palenque, NUEVO ARROYO, PALENQUE, CHIAPAS, 29960"
A6E24684-ED43-4121-AFE1-4E1952D429BC,359F7862-EDE8-4910-98C8-ACD42DBAC58C,Aborto,1,Culposo,1,2025-05-02,01:55:00,6,1,1.4,Chiapas,7,"Tuxtla Gutiérrez",101,"Tuxtla Gutiérrez",71010001,"Otra colonia",-10,0,-93.119739049319,16.755944205023,"Copoya, OTRA COLONIA, TUXTLA GUTIERREZ, CHIAPAS, 00000"
482454DE-6F34-4F6A-A6E4-569818106384,3628EB19-7F88-48C9-A3CE-BE1C8CBE5322,Homicidio,1,Culposo,1,2025-05-06,18:21:00,4,1,1.1.2,Chiapas,7,"San Cristóbal de las Casas",78,"Los Llanos",70780016,"Los Llanos",238,29310,-92.493122364001,16.672769511171,"LOS LLANOS, SAN CRISTOBAL DE LAS CASAS, CHIAPAS, 29310"
712D161E-7BA6-4D8C-B017-3BE3E660DC2D,362BCF0A-715B-49F6-9CB1-70F2EC5798AA,"Armas prohibidas",1,Doloso,2,2025-05-03,18:29:00,8,1,7.10,Chiapas,7,"Tuxtla Gutiérrez",101,"Tuxtla Gutiérrez",71010001,Montecristo,472,29000,-93.182730674744,16.735094108202,"Camino a Rancho Viejo MONTECRISTO TUXTLA GUTIERREZ CHIAPAS 29000"
2166416D-C71D-4A1C-BD76-77B9F64C117B,368AE220-D3E4-49A6-AEBC-A4A932CFA41F,"Desobediencia y resistencia de particulares",1,Doloso,2,2025-05-08,20:55:00,6,1,7.11.1,Chiapas,7,Tapachula,89,"Tapachula de Córdova y Ordóñez",70890001,"Nueva Alemania",233,30807,-92.262945749345,14.890196781699,"Framboyanes, NUEVA ALEMANIA, TAPACHULA, CHIAPAS, 30807"
29B08C83-0445-41BB-9763-C77983954A81,368F91DE-ABCA-4E23-A807-A3A308244757,"Contra la salud (Narcomenudeo)",1,Doloso,2,2025-05-30,01:00:00,8,1,7.1.2,Chiapas,7,Jiquipilas,46,"Baja California",70460008,"Baja California",1,30443,-93.648126125336,16.669141418803,"Calle Primera Oriente, BAJA CALIFORNIA, JIQUIPILAS, CHIAPAS, 30443"
24278069-FF09-4468-B9AB-2E0615C97BA0,36F414CD-858A-474F-8CFD-948982931FCD,Homicidio,1,Doloso,1,2025-05-25,21:53:00,1,1,1.1.1,Chiapas,7,Suchiate,87,Suchiate,70870184,Suchiate,107,30843,-92.152794328403,14.679337083252,"Suchiate, SUCHIATE, SUCHIATE, CHIAPAS, 30843"
6AA8B00F-4F1B-46B7-8C92-A05B3935D8E5,3704AEC2-F557-40CB-AB8E-4655A412DAC1,"Violencia familiar",1,Doloso,1,2025-05-02,12:31:00,6,1,5.1,Chiapas,7,"Comitán de Domínguez",19,"Comitán de Domínguez",70190001,"Ejido Las Flores",210,30000,-92.149339914322,16.21889010049,"Josefa Ortiz de Domínguez, EJIDO LAS FLORES, COMITAN DE DOMINGUEZ, CHIAPAS, 30000"
30B1BFE6-D3DD-47DB-9CD4-B5FD5C89A56C,37CC8DAC-4CD7-4E65-B9C8-45203DC8F04B,"Ataques a las vías de comunicación",1,Doloso,1,2025-04-29,22:32:00,8,1,7.10,Chiapas,7,"San Cristóbal de las Casas",78,"San Cristóbal de las Casas",70780001,"Corral de Piedra",189,29299,-92.636375427246,16.73725878992,"San Cristóbal, CORRAL DE PIEDRA, SAN CRISTOBAL DE LAS CASAS, CHIAPAS, 29299"
70118321-F63E-4FC6-A3A5-CF8535601269,38226BF7-6A1B-45B7-8B32-F3052F68E867,Violación,1,Doloso,1,2025-05-04,21:00:00,3,1,3.8.1,Chiapas,7,"Tuxtla Gutiérrez",101,"Tuxtla Gutiérrez",71010001,"Emiliano Zapata",150,29076,-93.090419769287,16.788123329184,"Avenida Lucio Cabañas, EMILIANO ZAPATA, TUXTLA GUTIERREZ, CHIAPAS, 29076"
5CEC279D-600B-4F23-9944-78A32C861D31,38765B4E-378D-4936-9F48-6923008B4462,"Robo Otros",1,Doloso,1,2025-05-06,07:55:00,6,1,4.1.14,Chiapas,7,Villaflores,108,Villaflores,71080001,"Dr. Domingo Chanona",13,30492,-93.386192321777,16.335223294661,"DR DOMINGO CHANONA, VILLAFLORES, CHIAPAS, 30492"
13E5E9FA-8A8B-4CA3-9723-AA334A277C75,38F6D645-BA95-466D-AA01-B3A9E97AE9FC,"Contra la salud (Narcomenudeo)",1,Doloso,2,2025-05-09,11:53:00,8,1,7.1.1,Chiapas,7,"Tuxtla Gutiérrez",101,"Tuxtla Gutiérrez",71010001,"Barrio Santo Domingo",406,29066,-93.119430541992,16.754213221085,"SIN DATOS SIN NUMERO, SIN NUMERO"
D20D5AE0-3236-4E46-8A80-2DF06113E7AC,393C8CC8-60CD-43D2-A997-6B70EB5AE8B3,Homicidio,1,Doloso,1,2025-01-16,12:20:00,1,1,1.1.1,Chiapas,7,Pantelhó,66,Pantelhó,70660001,"Otra colonia",-10,0,-92.470850686348,17.005732928277,"Guadalupe de la Peña, OTRA COLONIA, PANTELHO, CHIAPAS, 00000"
B99F969B-3D8B-4BE1-9256-3181EAB23E3E,395F40B9-8445-4DDD-8F87-364E06E4B139,"Ataques a las vías de comunicación",1,Culposo,1,2025-05-04,01:19:00,8,1,7.10,Chiapas,7,Tonalá,97,"San Ramón",70970395,"San Ramón",59,30500,-93.765724897385,16.096915525555,"Avenida Hidalgo, SAN RAMON, TONALA, CHIAPAS, 30500"
C81B6803-3A86-4A21-93F3-58873C1330D1,3A0705EB-4A27-4F58-BC3E-063A8B9996E2,"Ataques a las vías de comunicación",1,Doloso,1,2025-05-18,09:34:00,8,1,7.10,Chiapas,7,"San Cristóbal de las Casas",78,"San Cristóbal de las Casas",70780001,"San Ramón",161,29240,-92.653852701187,16.732383886887,"Diagonal Hermanos Paniagua, SAN RAMON, SAN CRISTOBAL DE LAS CASAS, CHIAPAS, 29240"
C084635E-CDCD-4EDD-A504-6C3B3B1F724D,3A1B5632-6E01-406C-BB22-B934BA307C42,"Contra la salud (Narcomenudeo)",1,Doloso,2,2025-05-12,01:00:00,8,1,7.1.2,Chiapas,7,"San Cristóbal de las Casas",78,"San Cristóbal de las Casas",70780001,"Anexo Morelos",232,29300,-92.637777352965,16.734492414848,"NO REFIERE 06, 00"
95CB03CB-8C99-4E59-B4E4-F3E56076F6C9,3A5C8335-2C31-450E-81F5-256C20C83CF4,"Abuso sexual",1,Doloso,2,2024-06-25,16:30:00,8,1,3.1,Chiapas,7,"Pueblo Nuevo Solistahuacán",72,"Pueblo Nuevo Solistahuacán",70720001,"Otra colonia",-10,29759,-92.902868391893,17.160206094237,"SIN DATO S/N"
939793D8-8B53-4981-A425-A408E2393D1A,3A656F40-7B07-44B4-B9A8-3FCADFF87B26,Daños,1,Culposo,1,2025-05-12,18:08:00,8,1,4.5,Chiapas,7,Suchiate,87,"Benito Juárez",70870245,"Benito Juárez",12,30846,-92.26787572507,14.637165969686,"Entrada Jaritas-Ciudad Hidalgo, BENITO JUAREZ, SUCHIATE, CHIAPAS, 30846"
D8E729BA-1694-4831-8718-8B875B87D9A9,3B103A50-5D92-4698-B6F2-366B510878D9,"Responsabilidad médica y técnica",1,Culposo,2,2025-02-11,12:54:00,8,1,7.10,Chiapas,7,"Tuxtla Gutiérrez",101,"Tuxtla Gutiérrez",71010001,"Otra colonia",-10,29000,-93.124237060547,16.751146586854,"Tuxtla Gutiérrez, OTRA COLONIA, TUXTLA GUTIERREZ, CHIAPAS, 29000"
CDDCCEE1-C7DF-4E46-AE3A-D1F8CCF972A8,3BAEC9C9-7B47-4151-99AF-8E743E5DBF73,Homicidio,1,Doloso,1,2025-05-01,19:31:00,1,1,1.1.1,Chiapas,7,Suchiate,87,"Ciudad Hidalgo",70870001,"Jesús Carranza",52,30844,-92.176374716874,14.640564953717,"Jesús, JESUS CARRANZA, SUCHIATE, CHIAPAS, 30844"
07352083-1105-433F-9F66-0F892CA5A760,3BFEFEB2-F77D-405C-8F53-42FEDEC0DC56,"Robo de Vehículo",1,Doloso,2,2025-04-29,13:02:00,6,1,4.1.2.2,Chiapas,7,"Tuxtla Gutiérrez",101,"Tuxtla Gutiérrez",71010001,Terán,413,29050,-93.162740585747,16.755646622558,"Calle 2 Oriente Norte, TERAN, TUXTLA GUTIERREZ, CHIAPAS, 29050"
4CCD227D-2427-49C0-8475-B09C53439F27,3C02E9EA-B8BC-4F2C-9492-CC04DA0D0EE4,Lesiones,1,Doloso,1,2025-04-14,09:08:00,6,1,1.2.1,Chiapas,7,"Ocozocoautla de Espinosa",61,"Ocozocoautla de Espinosa",70610001,"Unión Hidalgo",55,29140,-93.377094803289,16.758944419521,"Calle Cuarta Poniente Sur, UNION HIDALGO, OCOZOCOAUTLA DE ESPINOSA, CHIAPAS, 29140"
D821DBDE-3473-4B1C-904D-AE1C3F1C4591,3C8CC087-1B44-4BCB-B131-3C93E1B856F1,"Atentados contra la paz y la integridad corporal y patrimonial de la colectividad y del estado",0,Doloso,1,2025-05-07,11:17:00,1,1,7.10,Chiapas,7,"San Cristóbal de las Casas",78,"San Cristóbal de las Casas",70780001,"Huitepec las Palmas",208,29310,-92.681157588959,16.727470328507,"Huitepec Santa Anita, HUITEPEC LAS PALMAS, SAN CRISTOBAL DE LAS CASAS, CHIAPAS, 29310"
93E6E057-6F56-4390-9C7A-260F02EDC5AA,3CDE6E2F-A07E-4606-8233-CD9C55C7D17D,"Fraude   ",1,Doloso,2,2024-06-06,10:16:00,6,1,4.2,Chiapas,7,Tapalapa,90,Tapalapa,70900001,"Otra colonia",-10,30700,-93.107489788526,17.19059734992,"Tapalapa, Chiapas, México"
CE5625E9-56C1-4B8C-B9F4-96F2B71A99C8,3DA08465-4690-4F78-AC2F-C57EEE9E2232,Daños,0,Doloso,1,2025-05-16,17:05:00,8,1,4.5,Chiapas,7,Tapachula,89,"Tapachula de Córdova y Ordóñez",70890001,Coatancito,62,30730,-92.267990112305,14.894950067088,"Tapachula, COATANCITO, TAPACHULA, CHIAPAS, 30730"
6F3722E7-0295-443C-9BA5-164F789C3C3B,3DBB40DB-C291-4F0C-B51D-4CC1F6A29B5F,"Violencia familiar",1,Doloso,1,2025-05-08,12:58:00,6,1,5.1,Chiapas,7,Tecpatán,92,Tecpatán,70920001,"Tecpatan Centro",110,29610,-93.308840046634,17.133414291873,"Tecpatán, TECPATAN CENTRO, TECPATAN, CHIAPAS, 29610"
35129BFA-5722-432F-80CF-A67EF4933AD1,3DE6947D-E410-4F02-BA04-FFD8A4F697CF,"Ataques a las vías de comunicación",1,Doloso,1,2025-05-25,01:50:00,8,1,7.10,Chiapas,7,"Comitán de Domínguez",19,"Comitán de Domínguez",70190001,"Cruz Grande",38,30019,-92.142877728738,16.252364390512,"Boulevard Belisario Domínguez, CRUZ GRANDE, COMITAN DE DOMINGUEZ, CHIAPAS, 30019"
B6D1D945-AEF1-4D60-9AEF-A97F1FB0E17E,3F60A6F1-DDD7-4A4A-AEC3-334041B4F86E,"Robo Otros",0,Doloso,1,2025-05-18,15:15:00,6,1,4.1.14,Chiapas,7,Reforma,74,Reforma,70740001,"Ranchería Zaragoza",89,29500,-93.173503875732,17.842306569819,"Reforma, RANCHERIA ZARAGOZA, REFORMA, CHIAPAS, 29500"
ABF51D7D-06DC-4B15-9B89-B20B2B9DEC64,3F8D3CF8-5A3B-46ED-9A94-B6FD68D3B707,Homicidio,1,Doloso,1,2025-05-20,14:27:00,2,2,1.1.1,Chiapas,7,Palenque,65,Palenque,70650001,"Reforma Agrarista",70,29966,-91.502234941842,17.292331988219,"José María Morelos y Pavón, REFORMA AGRARISTA, PALENQUE, CHIAPAS, 29966"
FF57769E-CA85-4FA5-8656-CCB9EAE5BEC6,3FE5799E-A9BE-4D33-8216-43F313CEC2B4,Lesiones,0,Culposo,1,2025-05-19,21:30:00,6,1,1.2.2,Chiapas,7,Reforma,74,Reforma,70740001,"Fraccionamiento arco Iris",56,29500,-93.164176941136,17.851074056089,"Reforma, FRACCIONAMIENTO ARCO IRIS, REFORMA, CHIAPAS, 29500"
F69E7E05-547C-4079-AE5E-270A85F9B7E5,40C82F95-080B-441B-A851-7DE49B8D56B9,Daños,0,Doloso,1,2025-05-23,21:52:00,8,1,4.5,Chiapas,7,Tapachula,89,"Tapachula de Córdova y Ordóñez",70890001,"San Sebastián",308,30790,-92.261470059452,14.904905167774,"Fovi Banamex, SAN SEBASTIAN, TAPACHULA, CHIAPAS, 30790"
9C3089F2-F216-4B93-9947-5A907180DF7C,40C9E004-0A87-4DC1-B2AE-E860836971C8,"Ataques a las vías de comunicación",1,Doloso,1,2025-05-15,22:18:00,8,1,7.10,Chiapas,7,Mazatán,54,Mazatán,70540001,Mazatán,12,30650,-92.437465488911,14.901717323534,"Carretera a Mazatán, MAZATAN, MAZATAN, CHIAPAS, 30650"
174F9B97-F508-4F70-A6C1-CBC00C5E2232,410678F8-44CE-433A-8A29-3B420D9585AD,"Robo de Vehículo",1,Doloso,2,2025-05-16,04:01:00,6,1,4.1.2.1,Chiapas,7,Zinacantán,111,Zinacantán,71110001,"Otra colonia",-10,29350,-92.723581,16.760119,"OTRA COLONIA, ZINACANTAN, CHIAPAS, 29350"
8324F649-42D6-4423-889A-3CEF5EF826C9,4141BA87-3107-4672-A5DB-137B6C42C6A0,"Robo a Casa Habitación",1,Doloso,1,2025-04-29,23:39:00,6,1,4.1.1,Chiapas,7,Reforma,74,Reforma,70740001,"Luis Donaldo Colosio Zona 6",28,29500,-93.161962734735,17.84953237319,"Reforma, LUIS DONALDO COLOSIO ZONA 6, REFORMA, CHIAPAS, 29500"
861BCD00-B001-47AF-8965-D83EE2515F30,414F7DAC-85C2-4229-9319-ECEA17BC07C1,"Falsedad en declaraciones y en informes dados a una autoridad",0,Doloso,2,2024-04-03,12:31:00,8,1,7.5,Chiapas,7,"Tuxtla Gutiérrez",101,"Tuxtla Gutiérrez",71010001,"Los Choferes",257,29000,-93.082394599915,16.747073717153,"Boulevard Ángel Albino Corzo, Tuxtla Gutiérrez, Chiapas, 29077, México"
D031651E-1B61-4313-8002-F38936665845,41B3E295-4143-4ADA-9724-80E6797806E4,Lesiones,0,Doloso,1,2024-12-28,21:30:00,6,1,1.2.1,Chiapas,7,Berriozábal,12,"La Libertad",70120306,"La Libertad",45,29134,-93.243112564087,16.801081110137,"San Miguel, LA LIBERTAD, BERRIOZABAL, CHIAPAS, 29134"
287AC692-87DC-4D79-B24A-5BAD0D8C474F,41DB114A-C81D-4D00-977B-EA184742CB43,"Contra la salud (Narcomenudeo)",1,Doloso,2,2025-05-05,22:15:00,8,1,7.1.2,Chiapas,7,Tapachula,89,"Puerto Madero (San Benito)",70890148,"Puerto Madero Centro",271,30830,-92.411448568312,14.735029674607,"El Encanto, PUERTO MADERO CENTRO, TAPACHULA, CHIAPAS, 30830"
060FBFA1-6F60-4AEC-A5B6-C9E3A8069480,42506625-4556-4F56-A544-561CE30F52BA,Pandillerismo,1,Doloso,1,2025-05-10,14:32:00,6,1,7.10,Chiapas,7,Tuzantán,103,Tuzantán,71030001,Tuzantan,9,30680,-92.427978515625,15.125013878165,"Tuzantán, TUZANTAN, TUZANTAN, CHIAPAS, 30680"
5B327D11-E675-4385-BC81-910159DDF5E9,42635820-734A-45EA-9046-0BF7C2BD61AB,"Armas prohibidas",0,Doloso,2,2025-05-09,11:10:00,8,1,7.10,Chiapas,7,Tapachula,89,"Tapachula de Córdova y Ordóñez",70890001,"Fracc. Terranova",430,30700,-92.257927084214,14.869221246965,"Tapachula, FRACC TERRANOVA, TAPACHULA, CHIAPAS, 30700"
C3278A25-1EF5-4FEA-82BD-045D36411EF6,426A5BB8-0CAA-428B-BF63-69E13C532992,"Contra la salud (Narcomenudeo)",1,Doloso,2,2025-05-27,03:00:00,8,1,7.1.2,Chiapas,7,Tapachula,89,"Tapachula de Córdova y Ordóñez",70890001,"16 de Septiembre",5,30700,-92.258892059326,14.905271495882,"Framboyanes, 16 DE SEPTIEMBRE, TAPACHULA, CHIAPAS, 30700"
907E0197-0635-4B46-9DB8-CB9C866D413D,4273F70E-04B7-4F99-BED3-F5D3DD99BBA0,Homicidio,1,Culposo,1,2025-05-02,05:07:00,1,1,1.1.2,Chiapas,7,"Villa Corzo",107,"Villa Corzo",71070001,"Reforma Agraria",70,30525,-93.124408721924,16.061054886327,"Villa Corzo, REFORMA AGRARIA, VILLA CORZO, CHIAPAS, 30525"
682E2561-A567-4532-ACE2-C3DB54AF6214,42D2F81A-428D-4733-8BA2-13A38EF67087,Daños,0,Culposo,1,2025-05-09,23:16:00,8,1,4.5,Chiapas,7,"Tuxtla Gutiérrez",101,"Tuxtla Gutiérrez",71010001,Calvarium,83,29000,-93.118228912354,16.753720097306,"NINGUNA 21, S/N"
302B9D0F-A818-4220-8D37-07DBEB4F1A23,433CE924-FDCC-4A90-B507-7E4C240E5BED,Lesiones,1,Culposo,1,2025-05-02,06:30:00,4,1,1.2.2,Chiapas,7,Pichucalco,68,Pichucalco,70680001,"Mariano Matamoros 1a Sección",37,29525,-93.120288848877,17.510778028682,"MARIANO MATAMOROS 1A SECCION, PICHUCALCO, CHIAPAS, 29525"
E9F426BF-0634-4DE3-A17B-29126CC797E8,433D8CE2-A76A-4EB5-A6B9-4EC08DD79668,"Acoso Sexual",1,Doloso,1,2025-04-01,10:20:00,8,1,3.2,Chiapas,7,Palenque,65,Palenque,70650001,"Central Unitaria de los Trabajadores",15,29960,-91.988697052002,17.495552672029,"Palenque, CENTRAL UNITARIA DE LOS TRABAJADORES, PALENQUE, CHIAPAS, 29960"
0BEE374B-4245-4243-99DC-C13382DA7E05,43794717-CBE8-402D-93A8-7B870287052B,"Contra la salud (Narcomenudeo)",1,Doloso,2,2025-05-10,01:48:00,8,1,7.1.2,Chiapas,7,Tonalá,97,Tonalá,70970001,"Tonalá Centro",65,30500,-93.75337600708,16.088500955112,"Tonalá, TONALA CENTRO, TONALA, CHIAPAS, 30500"
728B4620-8FBA-4CFF-8FDA-DFC5F0E23461,440FA317-CC93-4B0C-BA27-034A05719AB6,"Ataques a las vías de comunicación",1,Culposo,1,2025-05-08,01:14:00,8,1,7.10,Chiapas,7,"Tuxtla Gutiérrez",101,"Tuxtla Gutiérrez",71010001,Bugambilias,78,29000,-93.144561871613,16.755256681992,"Boulevard Doctor Belisario Domínguez, BUGAMBILIAS, TUXTLA GUTIERREZ, CHIAPAS, 29000"
89BC97A2-9FC5-4785-97FA-8298095AF6E5,4428F24F-68CD-4120-8867-E5E484B16F77,Daños,1,Culposo,1,2025-05-07,16:09:00,8,1,4.5,Chiapas,7,Palenque,65,Palenque,70650001,"Palenque Centro",67,29960,-91.981573104858,17.508267416348,"Pakal-Ná, PALENQUE CENTRO, PALENQUE, CHIAPAS, 29960"
D36EE143-66CA-413E-AF2C-B0AD88E7654E,449B8975-EBA5-4B3F-93F1-92F379FF36A1,Homicidio,1,Culposo,1,2025-05-25,17:00:00,8,1,1.1.2,Chiapas,7,"La Trinitaria",99,"La Trinitaria",70990001,"Cristobal Colon (Lagos de Colon)",55,30160,-91.896851241572,15.828404032552,"Cristóbal Colón, CRISTOBAL COLON LAGOS DE COLON, LA TRINITARIA, CHIAPAS, 30160"
17C6BF21-9394-4DD4-8167-10DBD0A8065B,44AC8CF4-260A-4D70-A15D-649E577F742B,Ecocidio,1,Doloso,2,2025-05-21,05:02:00,6,1,7.7,Chiapas,7,Ocosingo,59,Ocosingo,70590001,Ocosingo,75,29950,-92.106628417969,16.930561405186,"Ocosingo, OCOSINGO, OCOSINGO, CHIAPAS, 29950"
1966BDF4-2B01-4939-8A2C-6F4B97594033,452A6C5F-D58E-4E13-956B-EB39F4B5C369,"Contra la salud (Narcomenudeo)",1,Doloso,2,2025-05-10,10:40:00,8,1,7.1.1,Chiapas,7,Huixtla,40,Huixtla,70400001,"Otra colonia",-10,30640,-92.472653388977,15.137806676445,"Las Hortencias, OTRA COLONIA, HUIXTLA, CHIAPAS, 30640"
26100B68-01F2-45C5-A18B-C01E348313F7,4598DDF6-CFDB-46A0-ABD0-4CDFC78C59FF,"Robo Otros",1,Doloso,2,2025-05-16,17:39:00,8,1,4.1.14,Chiapas,7,Tapachula,89,"Tapachula de Córdova y Ordóñez",70890001,"Ciudad de Tapachula",61,30709,-92.261846426125,14.90743203831,"Tapachula, CIUDAD DE TAPACHULA, TAPACHULA, CHIAPAS, 30709"
158A04A1-3F03-46DA-A345-85EA5E0C1454,45A36252-3C64-45EA-B260-F62708E21D6E,"Robo de Vehículo",1,Doloso,2,2025-05-09,15:00:00,6,1,4.1.2.1,Chiapas,7,"Villa Comaltitlán",71,"Villa Comaltitlán",70710001,"Otra colonia",-10,30620,-92.573817241218,15.215396749646,"Calle Tercera Oriente OTRA COLONIA VILLA COMALTITLAN CHIAPAS 30620"
2278630A-B2DA-43C2-96FF-BC1B870932A4,45A3C1DF-4405-4F9A-B7C1-A1290095F5D7,"Contra la salud (Narcomenudeo)",1,Doloso,2,2025-05-23,17:16:00,8,1,7.1.2,Chiapas,7,Villaflores,108,Villaflores,71080001,"Villaflores Centro",78,30475,-93.264999389648,16.23365008067,"Villaflores, VILLAFLORES CENTRO, VILLAFLORES, CHIAPAS, 30475"
35653989-6843-46B2-9774-56C5794AC469,466A96D0-BED6-451D-8D4D-05EDF68F8AEF,"Ataques a las vías de comunicación",1,Doloso,1,2025-05-29,18:15:00,8,1,7.10,Chiapas,7,Ixhuatán,42,Ixhuatán,70420001,Ixhuatan,6,29720,-93.003639969078,17.293242306106,"Calle Guadalupe, IXHUATAN, IXHUATAN, CHIAPAS, 29720"
4681A819-2B4F-4E73-9252-F3A6A6445AB2,471AAE9B-8EBD-4962-9AB5-A07CCE209D2C,"Desobediencia y resistencia de particulares",1,Doloso,2,2025-05-01,18:23:00,6,1,7.11.1,Chiapas,7,Motozintla,57,"Motozintla de Mendoza",70570001,"3 de Mayo",68,30900,-92.246533483163,15.365087669556,"Motozintla de Mendoza, 3 DE MAYO, MOTOZINTLA, CHIAPAS, 30900"
